16:59:33.671889 IP 192.168.43.101.49224 > 75.98.172.238.80: Flags [S], seq 1999546949, win 8192, options [mss 1460,nop,wscale 8,nop,nop,sackOK], length 0
E..4B)@....<..+eKb...H.Pw..E...... .................
16:59:36.672089 IP 192.168.43.101.49224 > 75.98.172.238.80: Flags [S], seq 1999546949, win 8192, options [mss 1460,nop,wscale 8,nop,nop,sackOK], length 0
E..4B*@....;..+eKb...H.Pw..E...... .................
16:59:42.672166 IP 192.168.43.101.49224 > 75.98.172.238.80: Flags [S], seq 1999546949, win 8192, options [mss 1460,nop,nop,sackOK], length 0
E..0B+@....>..+eKb...H.Pw..E....p. .............
16:59:59.674093 IP 192.168.43.101.49225 > 75.98.172.238.80: Flags [S], seq 2329452441, win 8192, options [mss 1460,nop,wscale 8,nop,nop,sackOK], length 0
E..4B.@....7..+eKb...I.P.......... .................
17:00:02.673700 IP 192.168.43.101.49225 > 75.98.172.238.80: Flags [S], seq 2329452441, win 8192, options [mss 1460,nop,wscale 8,nop,nop,sackOK], length 0
E..4B/@....6..+eKb...I.P.......... .................
17:00:08.673870 IP 192.168.43.101.49225 > 75.98.172.238.80: Flags [S], seq 2329452441, win 8192, options [mss 1460,nop,nop,sackOK], length 0
E..0B0@....9..+eKb...I.P........p. .............
17:00:25.675463 IP 192.168.43.101.49226 > 75.98.172.238.80: Flags [S], seq 240805406, win 8192, options [mss 1460,nop,wscale 8,nop,nop,sackOK], length 0
E..4B1@....4..+eKb...J.P.Zf....... .5...............
17:00:28.675392 IP 192.168.43.101.49226 > 75.98.172.238.80: Flags [S], seq 240805406, win 8192, options [mss 1460,nop,wscale 8,nop,nop,sackOK], length 0
E..4B2@....3..+eKb...J.P.Zf....... .5...............
17:00:34.675568 IP 192.168.43.101.49226 > 75.98.172.238.80: Flags [S], seq 240805406, win 8192, options [mss 1460,nop,nop,sackOK], length 0
E..0B3@....6..+eKb...J.P.Zf.....p. .I...........
17:00:51.677256 IP 192.168.43.101.49227 > 75.98.172.238.80: Flags [S], seq 2527915011, win 8192, options [mss 1460,nop,wscale 8,nop,nop,sackOK], length 0
E..4B4@....1..+eKb...K.P.......... .'f..............
17:00:54.677049 IP 192.168.43.101.49227 > 75.98.172.238.80: Flags [S], seq 2527915011, win 8192, options [mss 1460,nop,wscale 8,nop,nop,sackOK], length 0
E..4B5@....0..+eKb...K.P.......... .'f..............
17:01:00.677189 IP 192.168.43.101.49227 > 75.98.172.238.80: Flags [S], seq 2527915011, win 8192, options [mss 1460,nop,nop,sackOK], length 0
E..0B6@....3..+eKb...K.P........p. .;u..........
17:01:17.678786 IP 192.168.43.101.49228 > 75.98.172.238.80: Flags [S], seq 3647446179, win 8192, options [mss 1460,nop,wscale 8,nop,nop,sackOK], length 0
E..4B7@.......+eKb...L.P.g........ .4
..............
17:01:20.678740 IP 192.168.43.101.49228 > 75.98.172.238.80: Flags [S], seq 3647446179, win 8192, options [mss 1460,nop,wscale 8,nop,nop,sackOK], length 0
E..4B8@....-..+eKb...L.P.g........ .4
..............
17:01:26.678903 IP 192.168.43.101.49228 > 75.98.172.238.80: Flags [S], seq 3647446179, win 8192, options [mss 1460,nop,nop,sackOK], length 0
E..0B:@..../..+eKb...L.P.g......p. .H...........
17:01:43.680513 IP 192.168.43.101.49229 > 75.98.172.238.80: Flags [S], seq 2241950281, win 8192, options [mss 1460,nop,wscale 8,nop,nop,sackOK], length 0
E..4B;@....*..+eKb...M.P..rI...... ..)..............
17:01:46.680338 IP 192.168.43.101.49229 > 75.98.172.238.80: Flags [S], seq 2241950281, win 8192, options [mss 1460,nop,wscale 8,nop,nop,sackOK], length 0
E..4B<@....)..+eKb...M.P..rI...... ..)..............
17:01:52.680517 IP 192.168.43.101.49229 > 75.98.172.238.80: Flags [S], seq 2241950281, win 8192, options [mss 1460,nop,nop,sackOK], length 0
E..0B=@....,..+eKb...M.P..rI....p. ..8..........
17:02:09.682112 IP 192.168.43.101.49230 > 75.98.172.238.80: Flags [S], seq 811472058, win 8192, options [mss 1460,nop,wscale 8,nop,nop,sackOK], length 0
E..4B>@....'..+eKb...N.P0^........ .d...............
17:02:12.682078 IP 192.168.43.101.49230 > 75.98.172.238.80: Flags [S], seq 811472058, win 8192, options [mss 1460,nop,wscale 8,nop,nop,sackOK], length 0
E..4B?@....&..+eKb...N.P0^........ .d...............
17:02:18.682217 IP 192.168.43.101.49230 > 75.98.172.238.80: Flags [S], seq 811472058, win 8192, options [mss 1460,nop,nop,sackOK], length 0
E..0B@@....)..+eKb...N.P0^......p. .y
..........
17:02:35.195717 IP 192.168.43.101.49231 > 75.98.172.238.80: Flags [S], seq 2008617122, win 8192, options [mss 1460,nop,wscale 8,nop,nop,sackOK], length 0
E..4BA@....$..+eKb...O.Pw......... .!...............
17:02:35.683787 IP 192.168.43.101.49232 > 75.98.172.238.80: Flags [S], seq 1131747544, win 8192, options [mss 1460,nop,wscale 8,nop,nop,sackOK], length 0
E..4BB@....#..+eKb...P.PCu........ .M...............
17:02:38.195687 IP 192.168.43.101.49231 > 75.98.172.238.80: Flags [S], seq 2008617122, win 8192, options [mss 1460,nop,wscale 8,nop,nop,sackOK], length 0
E..4BC@...."..+eKb...O.Pw......... .!...............
17:02:38.683735 IP 192.168.43.101.49232 > 75.98.172.238.80: Flags [S], seq 1131747544, win 8192, options [mss 1460,nop,wscale 8,nop,nop,sackOK], length 0
E..4BD@....!..+eKb...P.PCu........ .M...............
17:02:44.195851 IP 192.168.43.101.49231 > 75.98.172.238.80: Flags [S], seq 2008617122, win 8192, options [mss 1460,nop,nop,sackOK], length 0
E..0BE@....$..+eKb...O.Pw.......p. .5...........
17:02:44.683906 IP 192.168.43.101.49232 > 75.98.172.238.80: Flags [S], seq 1131747544, win 8192, options [mss 1460,nop,nop,sackOK], length 0
E..0BF@....#..+eKb...P.PCu......p. .a...........
17:02:49.297900 IP 192.168.43.101.49233 > 65.55.58.195.80: Flags [S], seq 3586283573, win 8192, options [mss 1460,nop,wscale 2,nop,nop,sackOK], length 0
E..4BH@...Pt..+eA7:..Q.P..X5...... ..t..............
17:02:49.654483 IP 192.168.43.101.49233 > 65.55.58.195.80: Flags [.], ack 4216622311, win 4420, length 0
E..(BI@...P...+eA7:..Q.P..X6.T..P..D....
17:02:49.654821 IP 192.168.43.101.49233 > 65.55.58.195.80: Flags [P.], seq 0:339, ack 1, win 4420, length 339
E..{BJ@...O+..+eA7:..Q.P..X6.T..P..D.k..GET /fwlink/?LinkId=69157 HTTP/1.1
Accept: */*
Accept-Language: en-us
User-Agent: Mozilla/4.0 (compatible; MSIE 8.0; Windows NT 6.1; WOW64; Trident/4.0; SLCC2; .NET CLR 2.0.50727; .NET CLR 3.5.30729; .NET CLR 3.0.30729; Media Center PC 6.0; InfoPath.2)
Accept-Encoding: gzip, deflate
Host: go.microsoft.com
Connection: Keep-Alive


17:02:50.247561 IP 192.168.43.101.49234 > 131.253.13.140.80: Flags [S], seq 882621264, win 8192, options [mss 1460,nop,wscale 2,nop,nop,sackOK], length 0
E..4BL@...:...+e....R.P4..P...... . ...............
17:02:50.365010 IP 192.168.43.101.49233 > 65.55.58.195.80: Flags [.], ack 451, win 4307, length 0
E..(BM@...P{..+eA7:..Q.P..Y..T..P......
17:02:50.677169 IP 192.168.43.101.49234 > 131.253.13.140.80: Flags [.], ack 3000268032, win 4200, length 0
E..(BN@...:...+e....R.P4..Q..u.P..hIq..
17:02:50.677565 IP 192.168.43.101.49234 > 131.253.13.140.80: Flags [P.], seq 0:629, ack 1, win 4200, length 629
E...BO@...8u..+e....R.P4..Q..u.P..h....GET /?ocid=iehp HTTP/1.1
Accept: */*
Accept-Language: en-us
User-Agent: Mozilla/4.0 (compatible; MSIE 8.0; Windows NT 6.1; WOW64; Trident/4.0; SLCC2; .NET CLR 2.0.50727; .NET CLR 3.5.30729; .NET CLR 3.0.30729; Media Center PC 6.0; InfoPath.2)
Accept-Encoding: gzip, deflate
Host: www.msn.com
Connection: Keep-Alive
Cookie: MC1=V=3&GUID=c3ee03a104934efc839f2eb70fd1cffc; brdSample=13; mh=MSFT; CC=IN; SRCHD=D=2921113&MS=2921113&AF=NOFORM; SRCHUSR=AUTOREDIR=0&GEOVAR=&DOB=20130721; Sample=3; MUID=05888637C85B60CA033D8326CC5B62A4; MUIDB=2658DF399FA9634B2E06DA289EBA6357; SRCHUID=V=2&GUID=98DC267E61C5423CBFF18BDE29BA375A


17:02:51.279445 IP 192.168.43.101.49235 > 207.46.61.29.80: Flags [S], seq 3441112146, win 8192, options [mss 1460,nop,wscale 2,nop,nop,sackOK], length 0
E..4BQ@.......+e..=..S.P..4R...... .................
17:02:51.375677 IP 192.168.43.101.49235 > 207.46.61.29.80: Flags [.], ack 1065501810, win 4200, length 0
E..(BR@....$..+e..=..S.P..4S?.DrP..ha...
17:02:51.376060 IP 192.168.43.101.49235 > 207.46.61.29.80: Flags [P.], seq 0:639, ack 1, win 4200, length 639
E...BS@.......+e..=..S.P..4S?.DrP..h.c..GET /?rd=1&ucc=IN&dcc=IN&opt=0&ocid=iehp HTTP/1.1
Accept: */*
Accept-Language: en-us
User-Agent: Mozilla/4.0 (compatible; MSIE 8.0; Windows NT 6.1; WOW64; Trident/4.0; SLCC2; .NET CLR 2.0.50727; .NET CLR 3.5.30729; .NET CLR 3.0.30729; Media Center PC 6.0; InfoPath.2)
Accept-Encoding: gzip, deflate
Cookie: MC1=V=3&GUID=c3ee03a104934efc839f2eb70fd1cffc; brdSample=13; mh=MSFT; CC=IN; SRCHD=SM=1&D=2921113&MS=3026282&AF=NOFORM; SRCHUSR=AUTOREDIR=0&GEOVAR=&DOB=20130721; Sample=3; MUID=05888637C85B60CA033D8326CC5B62A4; _HOP=I=1&TS=1380722570; _SS=SID=D311C65A49A64312AFD8EADF9A867233; hpw=
Connection: Keep-Alive
Host: in.msn.com


17:02:51.398956 IP 192.168.43.101.49234 > 131.253.13.140.80: Flags [.], ack 917, win 3971, length 0
E..(BT@...:...+e....R.P4.....x.P...DM..
17:02:51.676074 IP 192.168.43.101.49235 > 207.46.61.29.80: Flags [P.], seq 0:639, ack 1, win 4200, length 639
E...BU@.......+e..=..S.P..4S?.DrP..h.c..GET /?rd=1&ucc=IN&dcc=IN&opt=0&ocid=iehp HTTP/1.1
Accept: */*
Accept-Language: en-us
User-Agent: Mozilla/4.0 (compatible; MSIE 8.0; Windows NT 6.1; WOW64; Trident/4.0; SLCC2; .NET CLR 2.0.50727; .NET CLR 3.5.30729; .NET CLR 3.0.30729; Media Center PC 6.0; InfoPath.2)
Accept-Encoding: gzip, deflate
Cookie: MC1=V=3&GUID=c3ee03a104934efc839f2eb70fd1cffc; brdSample=13; mh=MSFT; CC=IN; SRCHD=SM=1&D=2921113&MS=3026282&AF=NOFORM; SRCHUSR=AUTOREDIR=0&GEOVAR=&DOB=20130721; Sample=3; MUID=05888637C85B60CA033D8326CC5B62A4; _HOP=I=1&TS=1380722570; _SS=SID=D311C65A49A64312AFD8EADF9A867233; hpw=
Connection: Keep-Alive
Host: in.msn.com


17:02:51.680801 IP 192.168.43.101.49235 > 207.46.61.29.80: Flags [.], ack 2801, win 4200, length 0
E..(BV@.... ..+e..=..S.P..6.?.ObP..hS...
17:02:51.680997 IP 192.168.43.101.49235 > 207.46.61.29.80: Flags [.], ack 5601, win 4200, length 0
E..(BW@.......+e..=..S.P..6.?.ZRP..hH...
17:02:51.886722 IP 192.168.43.101.49235 > 207.46.61.29.80: Flags [.], ack 8401, win 4200, length 0
E..(BY@.......+e..=..S.P..6.?.eBP..h=...
17:02:51.887571 IP 192.168.43.101.49235 > 207.46.61.29.80: Flags [.], ack 11201, win 4200, length 0
E..(BZ@.......+e..=..S.P..6.?.p2P..h2...
17:02:51.895784 IP 192.168.43.101.49235 > 207.46.61.29.80: Flags [.], ack 14001, win 4200, length 0
E..(B[@.......+e..=..S.P..6.?.{"P..h'...
17:02:51.917966 IP 192.168.43.101.49235 > 207.46.61.29.80: Flags [.], ack 16801, win 3850, length 0
E..(B\@.......+e..=..S.P..6.?...P..
.K..
17:02:51.921339 IP 192.168.43.101.49236 > 184.84.106.156.80: Flags [S], seq 3472968427, win 8192, options [mss 1460,nop,wscale 2,nop,nop,sackOK], length 0
E..4B]@....h..+e.Tj..T.P..J....... .e...............
17:02:51.939000 IP 192.168.43.101.49235 > 207.46.61.29.80: Flags [.], ack 16801, win 4200, length 0
E..(B^@.......+e..=..S.P..6.?...P..h....
17:02:51.986901 IP 192.168.43.101.49235 > 207.46.61.29.80: Flags [.], ack 19601, win 4200, length 0
E..(B_@.......+e..=..S.P..6.?...P..h....
17:02:51.996971 IP 192.168.43.101.49235 > 207.46.61.29.80: Flags [.], ack 22401, win 4200, length 0
E..(B`@.......+e..=..S.P..6.?...P..h...
17:02:51.997984 IP 192.168.43.101.49235 > 207.46.61.29.80: Flags [.], ack 25201, win 4200, length 0
E..(Ba@.......+e..=..S.P..6.?...P..h....
17:02:52.008276 IP 192.168.43.101.49235 > 207.46.61.29.80: Flags [.], ack 28001, win 4200, length 0
E..(Bb@.......+e..=..S.P..6.?...P..h.,..
17:02:52.008487 IP 192.168.43.101.49236 > 184.84.106.156.80: Flags [.], ack 23236343, win 4200, length 0
E..(Bc@....n..+e.Tj..T.P..J..b..P..h%...
17:02:52.008754 IP 192.168.43.101.49235 > 207.46.61.29.80: Flags [.], ack 30801, win 4200, length 0
E..(Bd@.......+e..=..S.P..6.?...P..h.<..
17:02:52.009170 IP 192.168.43.101.49236 > 184.84.106.156.80: Flags [P.], seq 0:431, ack 1, win 4200, length 431
E...Be@.......+e.Tj..T.P..J..b..P..h%...GET /br/sc/css/fa/fd87a769ac90425c2e751a4060b2b2.css HTTP/1.1
Accept: */*
Referer: http://in.msn.com/?rd=1&ucc=IN&dcc=IN&opt=0&ocid=iehp
Accept-Language: en-US
User-Agent: Mozilla/4.0 (compatible; MSIE 8.0; Windows NT 6.1; WOW64; Trident/4.0; SLCC2; .NET CLR 2.0.50727; .NET CLR 3.5.30729; .NET CLR 3.0.30729; Media Center PC 6.0; InfoPath.2)
Accept-Encoding: gzip, deflate
Host: kaw.stc.s-msn.com
Connection: Keep-Alive


17:02:52.036250 IP 192.168.43.101.49235 > 207.46.61.29.80: Flags [.], ack 33601, win 4200, length 0
E..(Bf@.......+e..=..S.P..6.?...P..h.L..
17:02:52.076763 IP 192.168.43.101.49235 > 207.46.61.29.80: Flags [.], ack 36401, win 4200, length 0
E..(Bg@.......+e..=..S.P..6.?...P..h.\..
17:02:52.105940 IP 192.168.43.101.49236 > 184.84.106.156.80: Flags [.], ack 2801, win 4200, length 0
E..(Bh@....i..+e.Tj..T.P..L..b..P..h....
17:02:52.115611 IP 192.168.43.101.49236 > 184.84.106.156.80: Flags [.], ack 5601, win 4200, length 0
E..(Bi@....h..+e.Tj..T.P..L..b..P..h...
17:02:52.126790 IP 192.168.43.101.49236 > 184.84.106.156.80: Flags [.], ack 8401, win 4200, length 0
E..(Bj@....g..+e.Tj..T.P..L..b..P..h....
17:02:52.135803 IP 192.168.43.101.49236 > 184.84.106.156.80: Flags [.], ack 11201, win 3850, length 0
E..(Bk@....f..+e.Tj..T.P..L..b..P..
.p..
17:02:52.142586 IP 192.168.43.101.49236 > 184.84.106.156.80: Flags [.], ack 11201, win 4200, length 0
E..(Bl@....e..+e.Tj..T.P..L..b..P..h....
17:02:52.147007 IP 192.168.43.101.49236 > 184.84.106.156.80: Flags [.], ack 14001, win 4200, length 0
E..(Bm@....d..+e.Tj..T.P..L..b..P..h."..
17:02:52.176685 IP 192.168.43.101.49236 > 184.84.106.156.80: Flags [.], ack 16801, win 4200, length 0
E..(Bn@....c..+e.Tj..T.P..L..b..P..h.2..
17:02:52.187480 IP 192.168.43.101.49236 > 184.84.106.156.80: Flags [.], ack 19601, win 21700, length 0
E..(Bo@....b..+e.Tj..T.P..L..b..P.T.....
17:02:52.197026 IP 192.168.43.101.49236 > 184.84.106.156.80: Flags [.], ack 22401, win 26950, length 0
E..(Bp@....a..+e.Tj..T.P..L..b.wP.iFst..
17:02:52.216655 IP 192.168.43.101.49236 > 184.84.106.156.80: Flags [.], ack 25201, win 26600, length 0
E..(Bq@....`..+e.Tj..T.P..L..b.gP.g.i...
17:02:52.228243 IP 192.168.43.101.49236 > 184.84.106.156.80: Flags [.], ack 28001, win 28700, length 0
E..(Br@...._..+e.Tj..T.P..L..b.WP.p.V...
17:02:52.228361 IP 192.168.43.101.49236 > 184.84.106.156.80: Flags [.], ack 30801, win 28700, length 0
E..(Bs@....^..+e.Tj..T.P..L..c.GP.p.K...
17:02:52.281941 IP 192.168.43.101.49235 > 207.46.61.29.80: Flags [.], ack 37570, win 22050, length 0
E..(Bt@.......+e..=..S.P..6.?..3P.V"....
17:02:52.426049 IP 192.168.43.101.49236 > 184.84.106.156.80: Flags [.], ack 31853, win 28437, length 0
E..(Bu@....\..+e.Tj..T.P..L..c.cP.o.H...
17:02:52.697613 IP 192.168.43.101.49237 > 23.35.10.73.80: Flags [S], seq 1152716854, win 8192, options [mss 1460,nop,wscale 2,nop,nop,sackOK], length 0
E..4Bw@.......+e.#
I.U.PD..6...... .,...............
17:02:52.785619 IP 192.168.43.101.49237 > 23.35.10.73.80: Flags [.], ack 3224086148, win 4200, length 0
E..(By@.......+e.#
I.U.PD..7.+..P..h....
17:02:52.785903 IP 192.168.43.101.49237 > 23.35.10.73.80: Flags [P.], seq 0:484, ack 1, win 4200, length 484
E...Bz@.......+e.#
I.U.PD..7.+..P..h.X..GET /library/dapmsn.js HTTP/1.1
Accept: */*
Referer: http://in.msn.com/?rd=1&ucc=IN&dcc=IN&opt=0&ocid=iehp
Accept-Language: en-US
User-Agent: Mozilla/4.0 (compatible; MSIE 8.0; Windows NT 6.1; WOW64; Trident/4.0; SLCC2; .NET CLR 2.0.50727; .NET CLR 3.5.30729; .NET CLR 3.0.30729; Media Center PC 6.0; InfoPath.2)
Accept-Encoding: gzip, deflate
If-Modified-Since: Wed, 05 Sep 2012 23:06:23 GMT
If-None-Match: "91588811bb8bcd1:0"
Host: ads1.msads.net
Connection: Keep-Alive


17:02:52.866772 IP 192.168.43.101.49238 > 184.84.106.156.80: Flags [S], seq 423685424, win 8192, options [mss 1460,nop,wscale 2,nop,nop,sackOK], length 0
E..4B{@....J..+e.Tj..V.P.@.0...... .y...............
17:02:52.948382 IP 192.168.43.101.49238 > 184.84.106.156.80: Flags [.], ack 3250467407, win 4200, length 0
E..(B|@....U..+e.Tj..V.P.@.1..2OP..h.G..
17:02:52.948690 IP 192.168.43.101.49238 > 184.84.106.156.80: Flags [P.], seq 0:429, ack 1, win 4200, length 429
E...B}@.......+e.Tj..V.P.@.1..2OP..hb?..GET /br/sc/js/01/3484f5296659ba20fc658ec1d799ba.js HTTP/1.1
Accept: */*
Referer: http://in.msn.com/?rd=1&ucc=IN&dcc=IN&opt=0&ocid=iehp
Accept-Language: en-US
User-Agent: Mozilla/4.0 (compatible; MSIE 8.0; Windows NT 6.1; WOW64; Trident/4.0; SLCC2; .NET CLR 2.0.50727; .NET CLR 3.5.30729; .NET CLR 3.0.30729; Media Center PC 6.0; InfoPath.2)
Accept-Encoding: gzip, deflate
Host: kaw.stj.s-msn.com
Connection: Keep-Alive


17:02:53.036300 IP 192.168.43.101.49238 > 184.84.106.156.80: Flags [.], ack 2801, win 4200, length 0
E..(B~@....S..+e.Tj..V.P.@....=?P..h....
17:02:53.047546 IP 192.168.43.101.49238 > 184.84.106.156.80: Flags [.], ack 5601, win 4200, length 0
E..(B.@....R..+e.Tj..V.P.@....H/P..h....
17:02:53.047647 IP 192.168.43.101.49238 > 184.84.106.156.80: Flags [.], ack 8401, win 4200, length 0
E..(B.@....Q..+e.Tj..V.P.@....S.P..h....
17:02:53.056898 IP 192.168.43.101.49238 > 184.84.106.156.80: Flags [.], ack 11201, win 4200, length 0
E..(B.@....P..+e.Tj..V.P.@....^.P..h....
17:02:53.066074 IP 192.168.43.101.49238 > 184.84.106.156.80: Flags [.], ack 14001, win 4200, length 0
E..(B.@....O..+e.Tj..V.P.@....h.P..h....
17:02:53.096458 IP 192.168.43.101.49238 > 184.84.106.156.80: Flags [.], ack 16801, win 4200, length 0
E..(B.@....M..+e.Tj..V.P.@....s.P..h....
17:02:53.105890 IP 192.168.43.101.49238 > 184.84.106.156.80: Flags [.], ack 19601, win 4200, length 0
E..(B.@....L..+e.Tj..V.P.@....~.P..h.
..
17:02:53.127006 IP 192.168.43.101.49238 > 184.84.106.156.80: Flags [.], ack 22401, win 27300, length 0
E..(B.@....H..+e.Tj..V.P.@......P.j.!...
17:02:53.127896 IP 192.168.43.101.49238 > 184.84.106.156.80: Flags [.], ack 25201, win 27300, length 0
E..(B.@....G..+e.Tj..V.P.@......P.j.....
17:02:53.128940 IP 192.168.43.101.49238 > 184.84.106.156.80: Flags [.], ack 28001, win 30800, length 0
E..(B.@....F..+e.Tj..V.P.@......P.xP.Q..
17:02:53.148294 IP 192.168.43.101.49238 > 184.84.106.156.80: Flags [.], ack 30801, win 30450, length 0
E..(B.@....D..+e.Tj..V.P.@......P.v.....
17:02:53.157992 IP 192.168.43.101.49238 > 184.84.106.156.80: Flags [.], ack 33601, win 29750, length 0
E..(B.@....C..+e.Tj..V.P.@......P.t6....
17:02:53.161327 IP 192.168.43.101.49239 > 207.46.61.31.80: Flags [S], seq 3846574633, win 8192, options [mss 1460,nop,wscale 2,nop,nop,sackOK], length 0
E..4B.@.......+e..=..W.P.F.)...... .................
17:02:53.166011 IP 192.168.43.101.49237 > 23.35.10.73.80: Flags [.], ack 256, win 4136, length 0
E..(B.@.......+e.#
I.U.PD....+..P..(....
17:02:53.166214 IP 192.168.43.101.49238 > 184.84.106.156.80: Flags [.], ack 36401, win 29400, length 0
E..(B.@....@..+e.Tj..V.P.@......P.r.....
17:02:53.169205 IP 192.168.43.101.49240 > 122.178.225.24.80: Flags [S], seq 3635378751, win 8192, options [mss 1460,nop,wscale 2,nop,nop,sackOK], length 0
E..4B.@...pY..+ez....X.P..z?...... .................
17:02:53.197051 IP 192.168.43.101.49238 > 184.84.106.156.80: Flags [.], ack 39201, win 28700, length 0
E..(B.@....>..+e.Tj..V.P.@.....oP.p.....
17:02:53.198226 IP 192.168.43.101.49238 > 184.84.106.156.80: Flags [.], ack 42001, win 28000, length 0
E..(B.@....=..+e.Tj..V.P.@....._P.m`....
17:02:53.202189 IP 192.168.43.101.49238 > 184.84.106.156.80: Flags [.], ack 44801, win 28000, length 0
E..(B.@....<..+e.Tj..V.P.@.....OP.m`....
17:02:53.216725 IP 192.168.43.101.49238 > 184.84.106.156.80: Flags [.], ack 47601, win 27650, length 0
E..(B.@....;..+e.Tj..V.P.@.....?P.l.....
17:02:53.227437 IP 192.168.43.101.49238 > 184.84.106.156.80: Flags [.], ack 50401, win 27650, length 0
E..(B.@....:..+e.Tj..V.P.@...../P.l.....
17:02:53.229857 IP 192.168.43.101.49241 > 207.46.73.251.80: Flags [S], seq 2920828369, win 8192, options [mss 1460,nop,wscale 2,nop,nop,sackOK], length 0
E..4B.@.......+e..I..Y.P..M....... ..K..............
17:02:53.237370 IP 192.168.43.101.49238 > 184.84.106.156.80: Flags [.], ack 53201, win 46900, length 0
E..(B.@....8..+e.Tj..V.P.@......P..4\...
17:02:53.240445 IP 192.168.43.101.49242 > 122.178.225.48.80: Flags [S], seq 2067899435, win 8192, options [mss 1460,nop,wscale 2,nop,nop,sackOK], length 0
E..4B.@...p9..+ez..0.Z.P{A.+...... .'...............
17:02:53.241239 IP 192.168.43.101.49243 > 66.235.139.110.80: Flags [S], seq 301035264, win 8192, options [mss 1460,nop,wscale 2,nop,nop,sackOK], length 0
E..4B.@.......+eB..n.[.P..o....... .S...............
17:02:53.246330 IP 192.168.43.101.49238 > 184.84.106.156.80: Flags [.], ack 56001, win 46550, length 0
E..(B.@....5..+e.Tj..V.P.@.....P...Sk..
17:02:53.256198 IP 192.168.43.101.49238 > 184.84.106.156.80: Flags [.], ack 58801, win 46550, length 0
E..(B.@....4..+e.Tj..V.P.@......P...H{..
17:02:53.265938 IP 192.168.43.101.49238 > 184.84.106.156.80: Flags [.], ack 61601, win 46550, length 0
E..(B.@....3..+e.Tj..V.P.@....".P...=...
17:02:53.277279 IP 192.168.43.101.49238 > 184.84.106.156.80: Flags [.], ack 64401, win 45850, length 0
E..(B.@....2..+e.Tj..V.P.@....-.P...5W..
17:02:53.279050 IP 192.168.43.101.49240 > 122.178.225.24.80: Flags [.], ack 1812299385, win 4200, length 0
E..(B.@...pW..+ez....X.P..z@l.~yP..hY|..
17:02:53.279916 IP 192.168.43.101.49239 > 207.46.61.31.80: Flags [.], ack 2477668554, win 4200, length 0
E..(B.@.......+e..=..W.P.F.*..8.P..h"...
17:02:53.282739 IP 192.168.43.101.49239 > 207.46.61.31.80: Flags [P.], seq 0:1138, ack 1, win 4200, length 1138
E...B.@....`..+e..=..W.P.F.*..8.P..h.{..GET /c.gif?parsergroup=hops&evt=impr&js=1&rid=dc33c138dfbd447faa667accaf0191bd&pp=False&cts=1380722573077&aop=&dv.SNLogin=fb%3Af%2Ctw%3Af&dv.GrpFrMod=socialid%3Atwitter&hp=N&fk=D1&gp=P&optkey=default&clid=05888637C85B60CA033D8326CC5B62A4&rf=&cu=http%3A%2F%2Fin.msn.com%2F%3Frd%3D1%26ucc%3DIN%26dcc%3DIN%26opt%3D0%26ocid%3Diehp&sl=0&slv=0&bh=535&bw=1276&scr=1280x720&sd=32&di=9&pi=9574&ps=95101&mk=en-in&pn=MSN+India+Homepage+W&pid=220419&su=in.msn.com&pageid=220419&br=MSFT&mv=v15 HTTP/1.1
Accept: */*
Referer: http://in.msn.com/?rd=1&ucc=IN&dcc=IN&opt=0&ocid=iehp
Accept-Language: en-US
User-Agent: Mozilla/4.0 (compatible; MSIE 8.0; Windows NT 6.1; WOW64; Trident/4.0; SLCC2; .NET CLR 2.0.50727; .NET CLR 3.5.30729; .NET CLR 3.0.30729; Media Center PC 6.0; InfoPath.2)
Accept-Encoding: gzip, deflate
Host: udc.msn.com
Connection: Keep-Alive
Cookie: MC1=V=3&GUID=c3ee03a104934efc839f2eb70fd1cffc; brdSample=13; mh=MSFT; CC=IN; SRCHD=SM=1&D=2921113&MS=3026282&AF=NOFORM; SRCHUSR=AUTOREDIR=0&GEOVAR=&DOB=20130721; Sample=3; MUID=05888637C85B60CA033D8326CC5B62A4; _HOP=I=1&TS=1380722570; _SS=SID=D311C65A49A64312AFD8EADF9A867233


17:02:53.283004 IP 192.168.43.101.49240 > 122.178.225.24.80: Flags [P.], seq 0:578, ack 1, win 4200, length 578
E..jB.@...n...+ez....X.P..z@l.~yP..h.$..GET /b?c1=2&c2=3000001&c7=http%3A%2F%2Fin.msn.com%2F%3Frd%3D1%26ucc%3DIN%26dcc%3DIN%26opt%3D0%26ocid%3Diehp&c9=&rn=1380722573121 HTTP/1.1
Accept: */*
Referer: http://in.msn.com/?rd=1&ucc=IN&dcc=IN&opt=0&ocid=iehp
Accept-Language: en-US
User-Agent: Mozilla/4.0 (compatible; MSIE 8.0; Windows NT 6.1; WOW64; Trident/4.0; SLCC2; .NET CLR 2.0.50727; .NET CLR 3.5.30729; .NET CLR 3.0.30729; Media Center PC 6.0; InfoPath.2)
Accept-Encoding: gzip, deflate
Host: b.scorecardresearch.com
Connection: Keep-Alive
Cookie: UID=11585518-122.178.225.18-1374412405; UIDR=1374412405


17:02:53.287019 IP 192.168.43.101.49242 > 122.178.225.48.80: Flags [.], ack 924722395, win 4200, length 0
E..(B.@...p;..+ez..0.Z.P{A.,7.$.P..h.j..
17:02:53.287233 IP 192.168.43.101.49242 > 122.178.225.48.80: Flags [P.], seq 0:449, ack 1, win 4200, length 449
E...B.@...ny..+ez..0.Z.P{A.,7.$.P..h&...GET /partner/primedns.gif HTTP/1.1
Accept: */*
Referer: http://in.msn.com/?rd=1&ucc=IN&dcc=IN&opt=0&ocid=iehp
Accept-Language: en-US
User-Agent: Mozilla/4.0 (compatible; MSIE 8.0; Windows NT 6.1; WOW64; Trident/4.0; SLCC2; .NET CLR 2.0.50727; .NET CLR 3.5.30729; .NET CLR 3.0.30729; Media Center PC 6.0; InfoPath.2)
Accept-Encoding: gzip, deflate
If-Modified-Since: Wed, 30 May 2007 19:42:28 GMT
Host: www.bing.com
Connection: Keep-Alive


17:02:53.406135 IP 192.168.43.101.49241 > 207.46.73.251.80: Flags [.], ack 4124120970, win 4200, length 0
E..(B.@.......+e..I..Y.P..M.....P..h.D..
17:02:53.406271 IP 192.168.43.101.49241 > 207.46.73.251.80: Flags [P.], seq 0:802, ack 1, win 4200, length 802
E..JB.@.......+e..I..Y.P..M.....P..hA;..GET /c.gif?udc=true&di=9&pi=9574&ps=95101&lng=en-in&tp=in.msn.com&rid=dc33c138dfbd447faa667accaf0191bd&rnd=1380722573122&rf=&scr=1280x720 HTTP/1.1
Accept: */*
Referer: http://in.msn.com/?rd=1&ucc=IN&dcc=IN&opt=0&ocid=iehp
Accept-Language: en-US
User-Agent: Mozilla/4.0 (compatible; MSIE 8.0; Windows NT 6.1; WOW64; Trident/4.0; SLCC2; .NET CLR 2.0.50727; .NET CLR 3.5.30729; .NET CLR 3.0.30729; Media Center PC 6.0; InfoPath.2)
Accept-Encoding: gzip, deflate
Host: c.in.msn.com
Connection: Keep-Alive
Cookie: MC1=V=3&GUID=c3ee03a104934efc839f2eb70fd1cffc; brdSample=13; mh=MSFT; CC=IN; SRCHD=SM=1&D=2921113&MS=3026282&AF=NOFORM; SRCHUSR=AUTOREDIR=0&GEOVAR=&DOB=20130721; Sample=3; MUID=05888637C85B60CA033D8326CC5B62A4; _HOP=I=1&TS=1380722570; _SS=SID=D311C65A49A64312AFD8EADF9A867233; hpw=


17:02:53.450745 IP 192.168.43.101.49244 > 207.46.49.132.80: Flags [S], seq 127398796, win 8192, options [mss 1460,nop,wscale 2,nop,nop,sackOK], length 0
E..4B.@....Z..+e..1..\.P.......... .................
17:02:53.476075 IP 192.168.43.101.49238 > 184.84.106.156.80: Flags [.], ack 64490, win 45827, length 0
E..(B.@....'..+e.Tj..V.P.@.....8P...5...
17:02:53.505206 IP 192.168.43.101.49243 > 66.235.139.110.80: Flags [.], ack 1768860824, win 4200, length 0
E..(B.@.......+eB..n.[.P..o.in..P..h.`..
17:02:53.505321 IP 192.168.43.101.49243 > 66.235.139.110.80: Flags [P.], seq 0:958, ack 1, win 4200, length 958
E...B.@.......+eB..n.[.P..o.in..P..h.:..GET /b/ss/msnportalin/1/H.1-pdv-2/1380722573123?[AQB]&v=Y&j=1.3&ns=msnportal&v1=10%2F2013&v2=10%2F2%2F2013&t=2%2F9%2F2013+19%3A32%3A52+3+-330&server=Msn.com&cc=INR&c1=Portal&c=32&bh=535&bw=1276&g=http%3A%2F%2Fin.msn.com%2F%3Frd%3D1%26ucc%3DIN%26dcc%3DIN%26opt%3D0%26ocid%3Diehp&s=1280x720&k=Y&c29=http%3A%2F%2Fin.msn.com%2F%3Frd%3D1%26ucc%3DIN%26dcc%3DIN%26opt%3D0%26ocid%3Diehp&c42=0&ct=LAN&r=&pageName=MSN+India+Homepage+W&c3=v15&c2=en-in&ch=MSFT&c22=False&c19=fb%3Af%2Ctw%3Af&c7=socialid%3Atwitter&c23=&hp=N&[AQE] HTTP/1.1
Accept: */*
Referer: http://in.msn.com/?rd=1&ucc=IN&dcc=IN&opt=0&ocid=iehp
Accept-Language: en-US
User-Agent: Mozilla/4.0 (compatible; MSIE 8.0; Windows NT 6.1; WOW64; Trident/4.0; SLCC2; .NET CLR 2.0.50727; .NET CLR 3.5.30729; .NET CLR 3.0.30729; Media Center PC 6.0; InfoPath.2)
Accept-Encoding: gzip, deflate
Host: msnportal.112.2o7.net
Connection: Keep-Alive
Cookie: s_vi=[CS]v1|28F5EF3B05160774-600001A1C0032C02[CE]


17:02:53.545443 IP 192.168.43.101.49244 > 207.46.49.132.80: Flags [.], ack 500659242, win 17680, length 0
E..(B.@....b..+e..1..\.P......t*P.E.01..
17:02:53.545727 IP 192.168.43.101.49244 > 207.46.49.132.80: Flags [P.], seq 0:795, ack 1, win 17680, length 795
E..CB.@....F..+e..1..\.P......t*P.E.o...GET /ADSAdClient31.dll?GetSAd=&DPJS=4&PN=MSFT&ID=05888637C85B60CA033D8326CC5B62A4&MUID=05888637C85B60CA033D8326CC5B62A4&PG=INMHSB&AP=1390 HTTP/1.1
Accept: */*
Referer: http://in.msn.com/?rd=1&ucc=IN&dcc=IN&opt=0&ocid=iehp
Accept-Language: en-US
User-Agent: Mozilla/4.0 (compatible; MSIE 8.0; Windows NT 6.1; WOW64; Trident/4.0; SLCC2; .NET CLR 2.0.50727; .NET CLR 3.5.30729; .NET CLR 3.0.30729; Media Center PC 6.0; InfoPath.2)
Accept-Encoding: gzip, deflate
Host: rad.msn.com
Connection: Keep-Alive
Cookie: MC1=V=3&GUID=c3ee03a104934efc839f2eb70fd1cffc; brdSample=13; mh=MSFT; CC=IN; SRCHD=SM=1&D=2921113&MS=3026282&AF=NOFORM; SRCHUSR=AUTOREDIR=0&GEOVAR=&DOB=20130721; Sample=3; MUID=05888637C85B60CA033D8326CC5B62A4; _HOP=I=1&TS=1380722570; _SS=SID=D311C65A49A64312AFD8EADF9A867233


17:02:53.581051 IP 192.168.43.101.49245 > 207.46.49.132.80: Flags [S], seq 2358517395, win 8192, options [mss 1460,nop,wscale 2,nop,nop,sackOK], length 0
E..4B.@....T..+e..1..].P.......... .................
17:02:53.637408 IP 192.168.43.101.49246 > 184.84.106.156.80: Flags [S], seq 259740659, win 8192, options [mss 1460,nop,wscale 2,nop,nop,sackOK], length 0
E..4B.@.......+e.Tj..^.P.{S....... .................
17:02:53.638276 IP 192.168.43.101.49247 > 184.84.106.156.80: Flags [S], seq 3796784208, win 8192, options [mss 1460,nop,wscale 2,nop,nop,sackOK], length 0
E..4B.@.......+e.Tj.._.P.NTP...... .H...............
17:02:53.639963 IP 192.168.43.101.49240 > 122.178.225.24.80: Flags [.], ack 249, win 4138, length 0
E..(B.@...pD..+ez....X.P..|.l..qP..*V...
17:02:53.640935 IP 192.168.43.101.49248 > 184.84.106.156.80: Flags [S], seq 3288489852, win 8192, options [mss 1460,nop,wscale 2,nop,nop,sackOK], length 0
E..4B.@.......+e.Tj..`.P.._|...... .[...............
17:02:53.641279 IP 192.168.43.101.49236 > 184.84.106.156.80: Flags [P.], seq 431:834, ack 31853, win 28437, length 403
E...B.@.......+e.Tj..T.P..L..c.cP.o.$:..GET /as/wea3/i/en/39.gif HTTP/1.1
Accept: */*
Referer: http://in.msn.com/?rd=1&ucc=IN&dcc=IN&opt=0&ocid=iehp
Accept-Language: en-US
User-Agent: Mozilla/4.0 (compatible; MSIE 8.0; Windows NT 6.1; WOW64; Trident/4.0; SLCC2; .NET CLR 2.0.50727; .NET CLR 3.5.30729; .NET CLR 3.0.30729; Media Center PC 6.0; InfoPath.2)
Accept-Encoding: gzip, deflate
Host: kaw.stc.s-msn.com
Connection: Keep-Alive


17:02:53.641748 IP 192.168.43.101.49249 > 184.84.106.156.80: Flags [S], seq 1126756646, win 8192, options [mss 1460,nop,wscale 2,nop,nop,sackOK], length 0
E..4B.@.......+e.Tj..a.PC(.&...... .K...............
17:02:53.642747 IP 192.168.43.101.49250 > 184.84.106.156.80: Flags [S], seq 2012074536, win 8192, options [mss 1460,nop,wscale 2,nop,nop,sackOK], length 0
E..4B.@......+e.Tj..b.Pw..(...... .5O..............
17:02:53.643389 IP 192.168.43.101.49251 > 184.84.106.156.80: Flags [S], seq 3419724959, win 8192, options [mss 1460,nop,wscale 2,nop,nop,sackOK], length 0
E..4B.@.......+e.Tj..c.P.......... .................
17:02:53.646958 IP 192.168.43.101.49242 > 122.178.225.48.80: Flags [.], ack 197, win 4151, length 0
E..(B.@...p$..+ez..0.Z.P{A..7.%.P..7....
17:02:53.650725 IP 192.168.43.101.49244 > 207.46.49.132.80: Flags [.], ack 1496, win 17680, length 0
E..(B.@....S..+e..1..\.P......z.P.E.'?..
17:02:53.676047 IP 192.168.43.101.49245 > 207.46.49.132.80: Flags [.], ack 2572564509, win 17680, length 0
E..(B.@....R..+e..1..].P.....V8.P.E.@...
17:02:53.677376 IP 192.168.43.101.49245 > 207.46.49.132.80: Flags [P.], seq 0:795, ack 1, win 17680, length 795
E..CB.@....6..+e..1..].P.....V8.P.E.x...GET /ADSAdClient31.dll?GetSAd=&DPJS=4&PN=MSFT&ID=05888637C85B60CA033D8326CC5B62A4&MUID=05888637C85B60CA033D8326CC5B62A4&PG=IN9HTA&AP=1399 HTTP/1.1
Accept: */*
Referer: http://in.msn.com/?rd=1&ucc=IN&dcc=IN&opt=0&ocid=iehp
Accept-Language: en-US
User-Agent: Mozilla/4.0 (compatible; MSIE 8.0; Windows NT 6.1; WOW64; Trident/4.0; SLCC2; .NET CLR 2.0.50727; .NET CLR 3.5.30729; .NET CLR 3.0.30729; Media Center PC 6.0; InfoPath.2)
Accept-Encoding: gzip, deflate
Host: rad.msn.com
Connection: Keep-Alive
Cookie: MC1=V=3&GUID=c3ee03a104934efc839f2eb70fd1cffc; brdSample=13; mh=MSFT; CC=IN; SRCHD=SM=1&D=2921113&MS=3026282&AF=NOFORM; SRCHUSR=AUTOREDIR=0&GEOVAR=&DOB=20130721; Sample=3; MUID=05888637C85B60CA033D8326CC5B62A4; _HOP=I=1&TS=1380722570; _SS=SID=D311C65A49A64312AFD8EADF9A867233


17:02:53.682101 IP 192.168.43.101.49239 > 207.46.61.31.80: Flags [.], ack 367, win 4108, length 0
E..(B.@.......+e..=..W.P.F....:8P.......
17:02:53.685360 IP 192.168.43.101.49246 > 184.84.106.156.80: Flags [.], ack 3234475356, win 4200, length 0
E..(B.@.......+e.Tj..^.P.{S...-\P..h~)..
17:02:53.685520 IP 192.168.43.101.49246 > 184.84.106.156.80: Flags [P.], seq 0:508, ack 1, win 4200, length 508
E..$B.@.......+e.Tj..^.P.{S...-\P..hSG..GET /i/D8/C28BD4518C45A107121A2AB4331BA.gif HTTP/1.1
Accept: */*
Referer: http://in.msn.com/?rd=1&ucc=IN&dcc=IN&opt=0&ocid=iehp
Accept-Language: en-US
User-Agent: Mozilla/4.0 (compatible; MSIE 8.0; Windows NT 6.1; WOW64; Trident/4.0; SLCC2; .NET CLR 2.0.50727; .NET CLR 3.5.30729; .NET CLR 3.0.30729; Media Center PC 6.0; InfoPath.2)
Accept-Encoding: gzip, deflate
If-Modified-Since: Wed, 10 Oct 2012 07:18:42 GMT
If-None-Match: "03557ab7a6cd1:0"
Host: kaw.stb01.s-msn.com
Connection: Keep-Alive


17:02:53.685668 IP 192.168.43.101.49247 > 184.84.106.156.80: Flags [.], ack 18679165, win 4200, length 0
E..(B.@.......+e.Tj.._.P.NTQ...}P..h....
17:02:53.685804 IP 192.168.43.101.49247 > 184.84.106.156.80: Flags [P.], seq 0:509, ack 1, win 4200, length 509
E..%B.@.......+e.Tj.._.P.NTQ...}P..h49..GET /i/E6/8A93ABA7CA5C728741D0375AD754BF.gif HTTP/1.1
Accept: */*
Referer: http://in.msn.com/?rd=1&ucc=IN&dcc=IN&opt=0&ocid=iehp
Accept-Language: en-US
User-Agent: Mozilla/4.0 (compatible; MSIE 8.0; Windows NT 6.1; WOW64; Trident/4.0; SLCC2; .NET CLR 2.0.50727; .NET CLR 3.5.30729; .NET CLR 3.0.30729; Media Center PC 6.0; InfoPath.2)
Accept-Encoding: gzip, deflate
If-Modified-Since: Thu, 29 Dec 2011 01:57:20 GMT
If-None-Match: "00e932cdc5cc1:0"
Host: kaw.stb01.s-msn.com
Connection: Keep-Alive


17:02:53.696545 IP 192.168.43.101.49248 > 184.84.106.156.80: Flags [.], ack 3226744953, win 4200, length 0
E..(B.@......+e.Tj..`.P.._}.T8yP..h.o..
17:02:53.696777 IP 192.168.43.101.49248 > 184.84.106.156.80: Flags [P.], seq 0:509, ack 1, win 4200, length 509
E..%B.@.......+e.Tj..`.P.._}.T8yP..h&...GET /i/8D/FCAFD03486C39B84E2BFFA0C13AD.gif HTTP/1.1
Accept: */*
Referer: http://in.msn.com/?rd=1&ucc=IN&dcc=IN&opt=0&ocid=iehp
Accept-Language: en-US
User-Agent: Mozilla/4.0 (compatible; MSIE 8.0; Windows NT 6.1; WOW64; Trident/4.0; SLCC2; .NET CLR 2.0.50727; .NET CLR 3.5.30729; .NET CLR 3.0.30729; Media Center PC 6.0; InfoPath.2)
Accept-Encoding: gzip, deflate
If-Modified-Since: Thu, 29 Dec 2011 01:58:31 GMT
If-None-Match: "80bd3a5dcdc5cc1:0"
Host: kaw.stb01.s-msn.com
Connection: Keep-Alive


17:02:53.696804 IP 192.168.43.101.49249 > 184.84.106.156.80: Flags [.], ack 11258334, win 4200, length 0
E..(B.@.......+e.Tj..a.PC(.'....P..h....
17:02:53.697018 IP 192.168.43.101.49249 > 184.84.106.156.80: Flags [P.], seq 0:508, ack 1, win 4200, length 508
E..$B.@.......+e.Tj..a.PC(.'....P..hN...GET /i/1A/8949AE6BFE9A58B973698BEEBB19.gif HTTP/1.1
Accept: */*
Referer: http://in.msn.com/?rd=1&ucc=IN&dcc=IN&opt=0&ocid=iehp
Accept-Language: en-US
User-Agent: Mozilla/4.0 (compatible; MSIE 8.0; Windows NT 6.1; WOW64; Trident/4.0; SLCC2; .NET CLR 2.0.50727; .NET CLR 3.5.30729; .NET CLR 3.0.30729; Media Center PC 6.0; InfoPath.2)
Accept-Encoding: gzip, deflate
If-Modified-Since: Thu, 28 Mar 2013 03:12:10 GMT
If-None-Match: "1c60979622bce1:0"
Host: kaw.stb01.s-msn.com
Connection: Keep-Alive


17:02:53.707156 IP 192.168.43.101.49250 > 184.84.106.156.80: Flags [.], ack 3233382317, win 4200, length 0
E..(B.@....	..+e.Tj..b.Pw..)....P..hE=..
17:02:53.707412 IP 192.168.43.101.49250 > 184.84.106.156.80: Flags [P.], seq 0:424, ack 1, win 4200, length 424
E...B.@....`..+e.Tj..b.Pw..)....P..hR...GET /i/DB/69BB51B4E71D8E9D4118714AB4C24.jpg HTTP/1.1
Accept: */*
Referer: http://in.msn.com/?rd=1&ucc=IN&dcc=IN&opt=0&ocid=iehp
Accept-Language: en-US
User-Agent: Mozilla/4.0 (compatible; MSIE 8.0; Windows NT 6.1; WOW64; Trident/4.0; SLCC2; .NET CLR 2.0.50727; .NET CLR 3.5.30729; .NET CLR 3.0.30729; Media Center PC 6.0; InfoPath.2)
Accept-Encoding: gzip, deflate
Host: kaw.stb01.s-msn.com
Connection: Keep-Alive


17:02:53.710255 IP 192.168.43.101.49251 > 184.84.106.156.80: Flags [.], ack 5220041, win 4200, length 0
E..(B.@.......+e.Tj..c.P.....O..P..h.,..
17:02:53.711537 IP 192.168.43.101.49253 > 184.84.106.156.80: Flags [S], seq 1689589346, win 8192, options [mss 1460,nop,wscale 2,nop,nop,sackOK], length 0
E..4B.@.......+e.Tj..e.Pd..b...... ..K..............
17:02:53.711539 IP 192.168.43.101.49252 > 184.84.106.156.80: Flags [S], seq 3502110804, win 8192, options [mss 1460,nop,wscale 2,nop,nop,sackOK], length 0
E..4B.@.......+e.Tj..d.P...T...... ..P..............
17:02:53.711804 IP 192.168.43.101.49254 > 65.52.108.11.80: Flags [S], seq 520741229, win 8192, options [mss 1460,nop,wscale 2,nop,nop,sackOK], length 0
E..4B.@.......+eA4l..f.P.	.m...... .................
17:02:53.713670 IP 192.168.43.101.49251 > 184.84.106.156.80: Flags [P.], seq 0:422, ack 1, win 4200, length 422
E...B.@....]..+e.Tj..c.P.....O..P..hx$..GET /i/3B/96AB43E3ABA4C6DBF5F4A1792CC.jpg HTTP/1.1
Accept: */*
Referer: http://in.msn.com/?rd=1&ucc=IN&dcc=IN&opt=0&ocid=iehp
Accept-Language: en-US
User-Agent: Mozilla/4.0 (compatible; MSIE 8.0; Windows NT 6.1; WOW64; Trident/4.0; SLCC2; .NET CLR 2.0.50727; .NET CLR 3.5.30729; .NET CLR 3.0.30729; Media Center PC 6.0; InfoPath.2)
Accept-Encoding: gzip, deflate
Host: kaw.stb01.s-msn.com
Connection: Keep-Alive


17:02:53.714085 IP 192.168.43.101.49255 > 184.84.106.156.80: Flags [S], seq 3088315236, win 8192, options [mss 1460,nop,wscale 2,nop,nop,sackOK], length 0
E..4B.@.......+e.Tj..g.P...d...... .................
17:02:53.715316 IP 192.168.43.101.49256 > 184.84.106.156.80: Flags [S], seq 2269478225, win 8192, options [mss 1460,nop,wscale 2,nop,nop,sackOK], length 0
E..4B.@.......+e.Tj..h.P.E}Q...... .z...............
17:02:53.715606 IP 192.168.43.101.49257 > 184.84.106.156.80: Flags [S], seq 674624589, win 8192, options [mss 1460,nop,wscale 2,nop,nop,sackOK], length 0
E..4B.@.......+e.Tj..i.P(5.M...... .b...............
17:02:53.715835 IP 192.168.43.101.49258 > 184.84.106.156.80: Flags [S], seq 1419999981, win 8192, options [mss 1460,nop,wscale 2,nop,nop,sackOK], length 0
E..4B.@.......+e.Tj..j.PT.z....... .................
17:02:53.720252 IP 192.168.43.101.49236 > 184.84.106.156.80: Flags [P.], seq 834:1237, ack 32768, win 28700, length 403
E...B.@....k..+e.Tj..T.P..N..c..P.p.....GET /as/wea3/i/en/28.gif HTTP/1.1
Accept: */*
Referer: http://in.msn.com/?rd=1&ucc=IN&dcc=IN&opt=0&ocid=iehp
Accept-Language: en-US
User-Agent: Mozilla/4.0 (compatible; MSIE 8.0; Windows NT 6.1; WOW64; Trident/4.0; SLCC2; .NET CLR 2.0.50727; .NET CLR 3.5.30729; .NET CLR 3.0.30729; Media Center PC 6.0; InfoPath.2)
Accept-Encoding: gzip, deflate
Host: kaw.stc.s-msn.com
Connection: Keep-Alive


17:02:53.721177 IP 192.168.43.101.49259 > 184.84.106.156.80: Flags [S], seq 3150608332, win 8192, options [mss 1460,nop,wscale 2,nop,nop,sackOK], length 0
E..4B.@.......+e.Tj..k.P..w....... .K...............
17:02:53.767553 IP 192.168.43.101.49246 > 184.84.106.156.80: Flags [P.], seq 508:1017, ack 218, win 4145, length 509
E..%B.@.......+e.Tj..^.P.{U....5P..1....GET /i/4D/B5A5944BE398B72BCDDB5D1A47AF.gif HTTP/1.1
Accept: */*
Referer: http://in.msn.com/?rd=1&ucc=IN&dcc=IN&opt=0&ocid=iehp
Accept-Language: en-US
User-Agent: Mozilla/4.0 (compatible; MSIE 8.0; Windows NT 6.1; WOW64; Trident/4.0; SLCC2; .NET CLR 2.0.50727; .NET CLR 3.5.30729; .NET CLR 3.0.30729; Media Center PC 6.0; InfoPath.2)
Accept-Encoding: gzip, deflate
If-Modified-Since: Mon, 25 Feb 2013 07:21:58 GMT
If-None-Match: "e0f1eccb2813ce1:0"
Host: kaw.stb01.s-msn.com
Connection: Keep-Alive


17:02:53.768184 IP 192.168.43.101.49247 > 184.84.106.156.80: Flags [P.], seq 509:933, ack 217, win 4146, length 424
E...B.@....S..+e.Tj.._.P.NVN...UP..2....GET /i/92/8959D74ACB91CB3F23A431CFE9C8C.jpg HTTP/1.1
Accept: */*
Referer: http://in.msn.com/?rd=1&ucc=IN&dcc=IN&opt=0&ocid=iehp
Accept-Language: en-US
User-Agent: Mozilla/4.0 (compatible; MSIE 8.0; Windows NT 6.1; WOW64; Trident/4.0; SLCC2; .NET CLR 2.0.50727; .NET CLR 3.5.30729; .NET CLR 3.0.30729; Media Center PC 6.0; InfoPath.2)
Accept-Encoding: gzip, deflate
Host: kaw.stb01.s-msn.com
Connection: Keep-Alive


17:02:53.771021 IP 192.168.43.101.49248 > 184.84.106.156.80: Flags [P.], seq 509:933, ack 219, win 4145, length 424
E...B.@....R..+e.Tj..`.P..az.T9SP..1.V..GET /i/81/1DEDC6CDD7489AF39F68E9861BE8B.jpg HTTP/1.1
Accept: */*
Referer: http://in.msn.com/?rd=1&ucc=IN&dcc=IN&opt=0&ocid=iehp
Accept-Language: en-US
