  5  16.999295 192.168.43.101 -> 75.98.172.238 TCP 66 49224 > http [SYN] Seq=0 Win=8192 Len=0 MSS=1460 WS=256 SACK_PERM=1
  6  19.999495 192.168.43.101 -> 75.98.172.238 TCP 66 49224 > http [SYN] Seq=0 Win=8192 Len=0 MSS=1460 WS=256 SACK_PERM=1
 11  25.999572 192.168.43.101 -> 75.98.172.238 TCP 62 49224 > http [SYN] Seq=0 Win=8192 Len=0 MSS=1460 SACK_PERM=1
 18  43.001499 192.168.43.101 -> 75.98.172.238 TCP 66 49225 > http [SYN] Seq=0 Win=8192 Len=0 MSS=1460 WS=256 SACK_PERM=1
 19  46.001106 192.168.43.101 -> 75.98.172.238 TCP 66 49225 > http [SYN] Seq=0 Win=8192 Len=0 MSS=1460 WS=256 SACK_PERM=1
 22  52.001276 192.168.43.101 -> 75.98.172.238 TCP 62 49225 > http [SYN] Seq=0 Win=8192 Len=0 MSS=1460 SACK_PERM=1
 24  69.002869 192.168.43.101 -> 75.98.172.238 TCP 66 49226 > http [SYN] Seq=0 Win=8192 Len=0 MSS=1460 WS=256 SACK_PERM=1
 25  72.002798 192.168.43.101 -> 75.98.172.238 TCP 66 49226 > http [SYN] Seq=0 Win=8192 Len=0 MSS=1460 WS=256 SACK_PERM=1
 28  78.002974 192.168.43.101 -> 75.98.172.238 TCP 62 49226 > http [SYN] Seq=0 Win=8192 Len=0 MSS=1460 SACK_PERM=1
 29  95.004662 192.168.43.101 -> 75.98.172.238 TCP 66 49227 > http [SYN] Seq=0 Win=8192 Len=0 MSS=1460 WS=256 SACK_PERM=1
 30  98.004455 192.168.43.101 -> 75.98.172.238 TCP 66 49227 > http [SYN] Seq=0 Win=8192 Len=0 MSS=1460 WS=256 SACK_PERM=1
 33 104.004595 192.168.43.101 -> 75.98.172.238 TCP 62 49227 > http [SYN] Seq=0 Win=8192 Len=0 MSS=1460 SACK_PERM=1
 34 121.006192 192.168.43.101 -> 75.98.172.238 TCP 66 49228 > http [SYN] Seq=0 Win=8192 Len=0 MSS=1460 WS=256 SACK_PERM=1
 35 124.006146 192.168.43.101 -> 75.98.172.238 TCP 66 49228 > http [SYN] Seq=0 Win=8192 Len=0 MSS=1460 WS=256 SACK_PERM=1
 40 130.006309 192.168.43.101 -> 75.98.172.238 TCP 62 49228 > http [SYN] Seq=0 Win=8192 Len=0 MSS=1460 SACK_PERM=1
 41 147.007919 192.168.43.101 -> 75.98.172.238 TCP 66 49229 > http [SYN] Seq=0 Win=8192 Len=0 MSS=1460 WS=256 SACK_PERM=1
 42 150.007744 192.168.43.101 -> 75.98.172.238 TCP 66 49229 > http [SYN] Seq=0 Win=8192 Len=0 MSS=1460 WS=256 SACK_PERM=1
 45 156.007923 192.168.43.101 -> 75.98.172.238 TCP 62 49229 > http [SYN] Seq=0 Win=8192 Len=0 MSS=1460 SACK_PERM=1
 46 173.009518 192.168.43.101 -> 75.98.172.238 TCP 66 49230 > http [SYN] Seq=0 Win=8192 Len=0 MSS=1460 WS=256 SACK_PERM=1
 47 176.009484 192.168.43.101 -> 75.98.172.238 TCP 66 49230 > http [SYN] Seq=0 Win=8192 Len=0 MSS=1460 WS=256 SACK_PERM=1
 50 182.009623 192.168.43.101 -> 75.98.172.238 TCP 62 49230 > http [SYN] Seq=0 Win=8192 Len=0 MSS=1460 SACK_PERM=1
 51 198.523123 192.168.43.101 -> 75.98.172.238 TCP 66 49231 > http [SYN] Seq=0 Win=8192 Len=0 MSS=1460 WS=256 SACK_PERM=1
 52 199.011193 192.168.43.101 -> 75.98.172.238 TCP 66 49232 > http [SYN] Seq=0 Win=8192 Len=0 MSS=1460 WS=256 SACK_PERM=1
 53 201.523093 192.168.43.101 -> 75.98.172.238 TCP 66 49231 > http [SYN] Seq=0 Win=8192 Len=0 MSS=1460 WS=256 SACK_PERM=1
 54 202.011141 192.168.43.101 -> 75.98.172.238 TCP 66 49232 > http [SYN] Seq=0 Win=8192 Len=0 MSS=1460 WS=256 SACK_PERM=1
 57 207.523257 192.168.43.101 -> 75.98.172.238 TCP 62 49231 > http [SYN] Seq=0 Win=8192 Len=0 MSS=1460 SACK_PERM=1
 58 208.011312 192.168.43.101 -> 75.98.172.238 TCP 62 49232 > http [SYN] Seq=0 Win=8192 Len=0 MSS=1460 SACK_PERM=1
 61 212.625306 192.168.43.101 -> 65.55.58.195 TCP 66 49233 > http [SYN] Seq=0 Win=8192 Len=0 MSS=1460 WS=4 SACK_PERM=1
 62 212.981754 65.55.58.195 -> 192.168.43.101 TCP 66 http > 49233 [SYN, ACK] Seq=0 Ack=1 Win=8190 Len=0 MSS=1360 WS=16 SACK_PERM=1
 68 213.574967 192.168.43.101 -> 131.253.13.140 TCP 66 49234 > http [SYN] Seq=0 Win=8192 Len=0 MSS=1460 WS=4 SACK_PERM=1
 70 214.004418 131.253.13.140 -> 192.168.43.101 TCP 66 http > 49234 [SYN, ACK] Seq=0 Ack=1 Win=8192 Len=0 MSS=1400 WS=256 SACK_PERM=1
 77 214.606851 192.168.43.101 -> 207.46.61.29 TCP 66 49235 > http [SYN] Seq=0 Win=8192 Len=0 MSS=1460 WS=4 SACK_PERM=1
 78 214.702931 207.46.61.29 -> 192.168.43.101 TCP 66 http > 49235 [SYN, ACK] Seq=0 Ack=1 Win=8192 Len=0 MSS=1400 WS=256 SACK_PERM=1
104 215.248745 192.168.43.101 -> 184.84.106.156 TCP 66 49236 > http [SYN] Seq=0 Win=8192 Len=0 MSS=1460 WS=4 SACK_PERM=1
118 215.335772 184.84.106.156 -> 192.168.43.101 TCP 66 http > 49236 [SYN, ACK] Seq=0 Ack=1 Win=14600 Len=0 MSS=1400 SACK_PERM=1 WS=2
171 216.025019 192.168.43.101 -> 23.35.10.73  TCP 66 49237 > http [SYN] Seq=0 Win=8192 Len=0 MSS=1460 WS=4 SACK_PERM=1
173 216.112884  23.35.10.73 -> 192.168.43.101 TCP 66 http > 49237 [SYN, ACK] Seq=0 Ack=1 Win=14600 Len=0 MSS=1400 SACK_PERM=1 WS=2
177 216.194178 192.168.43.101 -> 184.84.106.156 TCP 66 49238 > http [SYN] Seq=0 Win=8192 Len=0 MSS=1460 WS=4 SACK_PERM=1
178 216.275625 184.84.106.156 -> 192.168.43.101 TCP 66 http > 49238 [SYN, ACK] Seq=0 Ack=1 Win=14600 Len=0 MSS=1400 SACK_PERM=1 WS=2
227 216.488733 192.168.43.101 -> 207.46.61.31 TCP 66 49239 > http [SYN] Seq=0 Win=8192 Len=0 MSS=1460 WS=4 SACK_PERM=1
232 216.496611 192.168.43.101 -> 122.178.225.24 TCP 66 49240 > http [SYN] Seq=0 Win=8192 Len=0 MSS=1460 WS=4 SACK_PERM=1
250 216.557263 192.168.43.101 -> 207.46.73.251 TCP 66 49241 > http [SYN] Seq=0 Win=8192 Len=0 MSS=1460 WS=4 SACK_PERM=1
256 216.567851 192.168.43.101 -> 122.178.225.48 TCP 66 49242 > http [SYN] Seq=0 Win=8192 Len=0 MSS=1460 WS=4 SACK_PERM=1
257 216.568645 192.168.43.101 -> 66.235.139.110 TCP 66 49243 > http [SYN] Seq=0 Win=8192 Len=0 MSS=1460 WS=4 SACK_PERM=1
270 216.606368 122.178.225.24 -> 192.168.43.101 TCP 66 http > 49240 [SYN, ACK] Seq=0 Ack=1 Win=14600 Len=0 MSS=1400 SACK_PERM=1 WS=2
272 216.607252 207.46.61.31 -> 192.168.43.101 TCP 66 http > 49239 [SYN, ACK] Seq=0 Ack=1 Win=4200 Len=0 MSS=1400 WS=1 SACK_PERM=1
276 216.614342 122.178.225.48 -> 192.168.43.101 TCP 66 http > 49242 [SYN, ACK] Seq=0 Ack=1 Win=14600 Len=0 MSS=1400 SACK_PERM=1 WS=2
280 216.733468 207.46.73.251 -> 192.168.43.101 TCP 66 http > 49241 [SYN, ACK] Seq=0 Ack=1 Win=4200 Len=0 MSS=1400 WS=1 SACK_PERM=1
288 216.778151 192.168.43.101 -> 207.46.49.132 TCP 66 49244 > http [SYN] Seq=0 Win=8192 Len=0 MSS=1460 WS=4 SACK_PERM=1
291 216.832544 66.235.139.110 -> 192.168.43.101 TCP 66 http > 49243 [SYN, ACK] Seq=0 Ack=1 Win=4200 Len=0 MSS=1400 WS=1 SACK_PERM=1
294 216.872719 207.46.49.132 -> 192.168.43.101 TCP 58 http > 49244 [SYN, ACK] Seq=0 Ack=1 Win=8190 Len=0 MSS=1360
297 216.908457 192.168.43.101 -> 207.46.49.132 TCP 66 49245 > http [SYN] Seq=0 Win=8192 Len=0 MSS=1460 WS=4 SACK_PERM=1
301 216.964814 192.168.43.101 -> 184.84.106.156 TCP 66 49246 > http [SYN] Seq=0 Win=8192 Len=0 MSS=1460 WS=4 SACK_PERM=1
302 216.965682 192.168.43.101 -> 184.84.106.156 TCP 66 49247 > http [SYN] Seq=0 Win=8192 Len=0 MSS=1460 WS=4 SACK_PERM=1
304 216.968341 192.168.43.101 -> 184.84.106.156 TCP 66 49248 > http [SYN] Seq=0 Win=8192 Len=0 MSS=1460 WS=4 SACK_PERM=1
306 216.969154 192.168.43.101 -> 184.84.106.156 TCP 66 49249 > http [SYN] Seq=0 Win=8192 Len=0 MSS=1460 WS=4 SACK_PERM=1
308 216.970153 192.168.43.101 -> 184.84.106.156 TCP 66 49250 > http [SYN] Seq=0 Win=8192 Len=0 MSS=1460 WS=4 SACK_PERM=1
310 216.970795 192.168.43.101 -> 184.84.106.156 TCP 66 49251 > http [SYN] Seq=0 Win=8192 Len=0 MSS=1460 WS=4 SACK_PERM=1
315 217.003358 207.46.49.132 -> 192.168.43.101 TCP 58 http > 49245 [SYN, ACK] Seq=0 Ack=1 Win=8190 Len=0 MSS=1360
319 217.012693 184.84.106.156 -> 192.168.43.101 TCP 66 http > 49246 [SYN, ACK] Seq=0 Ack=1 Win=14600 Len=0 MSS=1400 SACK_PERM=1 WS=2
322 217.013008 184.84.106.156 -> 192.168.43.101 TCP 66 http > 49247 [SYN, ACK] Seq=0 Ack=1 Win=14600 Len=0 MSS=1400 SACK_PERM=1 WS=2
325 217.023876 184.84.106.156 -> 192.168.43.101 TCP 66 http > 49248 [SYN, ACK] Seq=0 Ack=1 Win=14600 Len=0 MSS=1400 SACK_PERM=1 WS=2
327 217.024167 184.84.106.156 -> 192.168.43.101 TCP 66 http > 49249 [SYN, ACK] Seq=0 Ack=1 Win=14600 Len=0 MSS=1400 SACK_PERM=1 WS=2
331 217.034466 184.84.106.156 -> 192.168.43.101 TCP 66 http > 49250 [SYN, ACK] Seq=0 Ack=1 Win=14600 Len=0 MSS=1400 SACK_PERM=1 WS=2
335 217.037598 184.84.106.156 -> 192.168.43.101 TCP 66 http > 49251 [SYN, ACK] Seq=0 Ack=1 Win=14600 Len=0 MSS=1400 SACK_PERM=1 WS=2
339 217.038943 192.168.43.101 -> 184.84.106.156 TCP 66 49253 > http [SYN] Seq=0 Win=8192 Len=0 MSS=1460 WS=4 SACK_PERM=1
340 217.038945 192.168.43.101 -> 184.84.106.156 TCP 66 49252 > http [SYN] Seq=0 Win=8192 Len=0 MSS=1460 WS=4 SACK_PERM=1
341 217.039210 192.168.43.101 -> 65.52.108.11 TCP 66 49254 > http [SYN] Seq=0 Win=8192 Len=0 MSS=1460 WS=4 SACK_PERM=1
343 217.041491 192.168.43.101 -> 184.84.106.156 TCP 66 49255 > http [SYN] Seq=0 Win=8192 Len=0 MSS=1460 WS=4 SACK_PERM=1
344 217.042722 192.168.43.101 -> 184.84.106.156 TCP 66 49256 > http [SYN] Seq=0 Win=8192 Len=0 MSS=1460 WS=4 SACK_PERM=1
345 217.043012 192.168.43.101 -> 184.84.106.156 TCP 66 49257 > http [SYN] Seq=0 Win=8192 Len=0 MSS=1460 WS=4 SACK_PERM=1
346 217.043241 192.168.43.101 -> 184.84.106.156 TCP 66 49258 > http [SYN] Seq=0 Win=8192 Len=0 MSS=1460 WS=4 SACK_PERM=1
348 217.048583 192.168.43.101 -> 184.84.106.156 TCP 66 49259 > http [SYN] Seq=0 Win=8192 Len=0 MSS=1460 WS=4 SACK_PERM=1
360 217.099097 184.84.106.156 -> 192.168.43.101 TCP 66 http > 49253 [SYN, ACK] Seq=0 Ack=1 Win=14600 Len=0 MSS=1400 SACK_PERM=1 WS=2
379 217.137164 184.84.106.156 -> 192.168.43.101 TCP 66 http > 49252 [SYN, ACK] Seq=0 Ack=1 Win=14600 Len=0 MSS=1400 SACK_PERM=1 WS=2
382 217.143850 184.84.106.156 -> 192.168.43.101 TCP 66 http > 49255 [SYN, ACK] Seq=0 Ack=1 Win=14600 Len=0 MSS=1400 SACK_PERM=1 WS=2
384 217.143977 184.84.106.156 -> 192.168.43.101 TCP 66 http > 49256 [SYN, ACK] Seq=0 Ack=1 Win=14600 Len=0 MSS=1400 SACK_PERM=1 WS=2
390 217.154474 184.84.106.156 -> 192.168.43.101 TCP 66 http > 49257 [SYN, ACK] Seq=0 Ack=1 Win=14600 Len=0 MSS=1400 SACK_PERM=1 WS=2
393 217.156483 184.84.106.156 -> 192.168.43.101 TCP 66 http > 49258 [SYN, ACK] Seq=0 Ack=1 Win=14600 Len=0 MSS=1400 SACK_PERM=1 WS=2
398 217.157592 184.84.106.156 -> 192.168.43.101 TCP 66 http > 49259 [SYN, ACK] Seq=0 Ack=1 Win=14600 Len=0 MSS=1400 SACK_PERM=1 WS=2
643 217.758826 192.168.43.101 -> 111.221.21.79 TCP 66 49260 > http [SYN] Seq=0 Win=8192 Len=0 MSS=1460 WS=4 SACK_PERM=1
690 217.853111 111.221.21.79 -> 192.168.43.101 TCP 62 http > 49260 [SYN, ACK] Seq=0 Ack=1 Win=8192 Len=0 MSS=1400 SACK_PERM=1
708 218.173246 192.168.43.101 -> 111.221.21.79 TCP 66 49261 > http [SYN] Seq=0 Win=8192 Len=0 MSS=1460 WS=4 SACK_PERM=1
711 218.305954 111.221.21.79 -> 192.168.43.101 TCP 62 http > 49261 [SYN, ACK] Seq=0 Ack=1 Win=8192 Len=0 MSS=1400 SACK_PERM=1
715 218.316261 192.168.43.101 -> 122.178.225.8 TCP 66 49262 > http [SYN] Seq=0 Win=8192 Len=0 MSS=1460 WS=4 SACK_PERM=1
717 218.355056 192.168.43.101 -> 122.178.225.26 TCP 66 49263 > http [SYN] Seq=0 Win=8192 Len=0 MSS=1460 WS=4 SACK_PERM=1
718 218.473954 122.178.225.8 -> 192.168.43.101 TCP 66 http > 49262 [SYN, ACK] Seq=0 Ack=1 Win=14600 Len=0 MSS=1400 SACK_PERM=1 WS=2
721 218.474838 122.178.225.26 -> 192.168.43.101 TCP 66 http > 49263 [SYN, ACK] Seq=0 Ack=1 Win=14600 Len=0 MSS=1400 SACK_PERM=1 WS=2
727 218.508709 192.168.43.101 -> 122.178.225.26 TCP 66 49264 > http [SYN] Seq=0 Win=8192 Len=0 MSS=1460 WS=4 SACK_PERM=1
745 218.607165 122.178.225.26 -> 192.168.43.101 TCP 66 http > 49264 [SYN, ACK] Seq=0 Ack=1 Win=14600 Len=0 MSS=1400 SACK_PERM=1 WS=2
818 218.973568 192.168.43.101 -> 122.178.225.9 TCP 66 49265 > http [SYN] Seq=0 Win=8192 Len=0 MSS=1460 WS=4 SACK_PERM=1
820 219.033047 122.178.225.9 -> 192.168.43.101 TCP 66 http > 49265 [SYN, ACK] Seq=0 Ack=1 Win=14600 Len=0 MSS=1400 SACK_PERM=1 WS=2
850 219.975127 192.168.43.101 -> 122.178.225.34 TCP 66 49266 > http [SYN] Seq=0 Win=8192 Len=0 MSS=1460 WS=4 SACK_PERM=1
851 220.023164 122.178.225.34 -> 192.168.43.101 TCP 66 http > 49266 [SYN, ACK] Seq=0 Ack=1 Win=14600 Len=0 MSS=1400 SACK_PERM=1 WS=2
854 220.038470 192.168.43.101 -> 65.52.108.11 TCP 66 49254 > http [SYN] Seq=0 Win=8192 Len=0 MSS=1460 WS=4 SACK_PERM=1
864 220.293683 192.168.43.101 -> 122.178.225.24 TCP 66 49267 > http [SYN] Seq=0 Win=8192 Len=0 MSS=1460 WS=4 SACK_PERM=1
865 220.343096 122.178.225.24 -> 192.168.43.101 TCP 66 http > 49267 [SYN, ACK] Seq=0 Ack=1 Win=14600 Len=0 MSS=1400 SACK_PERM=1 WS=2
879 220.482845 65.52.108.11 -> 192.168.43.101 TCP 66 http > 49254 [SYN, ACK] Seq=0 Ack=1 Win=8192 Len=0 MSS=1400 WS=256 SACK_PERM=1
888 224.520183 192.168.43.101 -> 75.98.172.238 TCP 66 49268 > http [SYN] Seq=0 Win=8192 Len=0 MSS=1460 WS=256 SACK_PERM=1
889 225.015881 192.168.43.101 -> 75.98.172.238 TCP 66 49269 > http [SYN] Seq=0 Win=8192 Len=0 MSS=1460 WS=256 SACK_PERM=1
890 227.519743 192.168.43.101 -> 75.98.172.238 TCP 66 49268 > http [SYN] Seq=0 Win=8192 Len=0 MSS=1460 WS=256 SACK_PERM=1
891 228.015778 192.168.43.101 -> 75.98.172.238 TCP 66 49269 > http [SYN] Seq=0 Win=8192 Len=0 MSS=1460 WS=256 SACK_PERM=1
893 233.519919 192.168.43.101 -> 75.98.172.238 TCP 62 49268 > http [SYN] Seq=0 Win=8192 Len=0 MSS=1460 SACK_PERM=1
894 234.015956 192.168.43.101 -> 75.98.172.238 TCP 62 49269 > http [SYN] Seq=0 Win=8192 Len=0 MSS=1460 SACK_PERM=1
895 250.521452 192.168.43.101 -> 75.98.172.238 TCP 66 49270 > http [SYN] Seq=0 Win=8192 Len=0 MSS=1460 WS=256 SACK_PERM=1
896 251.017470 192.168.43.101 -> 75.98.172.238 TCP 66 49271 > http [SYN] Seq=0 Win=8192 Len=0 MSS=1460 WS=256 SACK_PERM=1
898 253.521414 192.168.43.101 -> 75.98.172.238 TCP 66 49270 > http [SYN] Seq=0 Win=8192 Len=0 MSS=1460 WS=256 SACK_PERM=1
899 254.017484 192.168.43.101 -> 75.98.172.238 TCP 66 49271 > http [SYN] Seq=0 Win=8192 Len=0 MSS=1460 WS=256 SACK_PERM=1
902 259.521556 192.168.43.101 -> 75.98.172.238 TCP 62 49270 > http [SYN] Seq=0 Win=8192 Len=0 MSS=1460 SACK_PERM=1
903 260.017621 192.168.43.101 -> 75.98.172.238 TCP 62 49271 > http [SYN] Seq=0 Win=8192 Len=0 MSS=1460 SACK_PERM=1
908 276.523258 192.168.43.101 -> 75.98.172.238 TCP 66 49272 > http [SYN] Seq=0 Win=8192 Len=0 MSS=1460 WS=256 SACK_PERM=1
909 277.019242 192.168.43.101 -> 75.98.172.238 TCP 66 49273 > http [SYN] Seq=0 Win=8192 Len=0 MSS=1460 WS=256 SACK_PERM=1
912 279.523092 192.168.43.101 -> 75.98.172.238 TCP 66 49272 > http [SYN] Seq=0 Win=8192 Len=0 MSS=1460 WS=256 SACK_PERM=1
913 280.019141 192.168.43.101 -> 75.98.172.238 TCP 66 49273 > http [SYN] Seq=0 Win=8192 Len=0 MSS=1460 WS=256 SACK_PERM=1
916 285.523254 192.168.43.101 -> 75.98.172.238 TCP 62 49272 > http [SYN] Seq=0 Win=8192 Len=0 MSS=1460 SACK_PERM=1
917 286.019303 192.168.43.101 -> 75.98.172.238 TCP 62 49273 > http [SYN] Seq=0 Win=8192 Len=0 MSS=1460 SACK_PERM=1
946 298.585101 192.168.43.101 -> 75.98.172.238 TCP 66 49274 > http [SYN] Seq=0 Win=8192 Len=0 MSS=1460 WS=256 SACK_PERM=1
947 301.584659 192.168.43.101 -> 75.98.172.238 TCP 66 49274 > http [SYN] Seq=0 Win=8192 Len=0 MSS=1460 WS=256 SACK_PERM=1
948 302.524791 192.168.43.101 -> 75.98.172.238 TCP 66 49275 > http [SYN] Seq=0 Win=8192 Len=0 MSS=1460 WS=256 SACK_PERM=1
951 305.524774 192.168.43.101 -> 75.98.172.238 TCP 66 49275 > http [SYN] Seq=0 Win=8192 Len=0 MSS=1460 WS=256 SACK_PERM=1
954 307.584797 192.168.43.101 -> 75.98.172.238 TCP 62 49274 > http [SYN] Seq=0 Win=8192 Len=0 MSS=1460 SACK_PERM=1
955 311.524947 192.168.43.101 -> 75.98.172.238 TCP 62 49275 > http [SYN] Seq=0 Win=8192 Len=0 MSS=1460 SACK_PERM=1
956 324.586430 192.168.43.101 -> 75.98.172.238 TCP 66 49276 > http [SYN] Seq=0 Win=8192 Len=0 MSS=1460 WS=256 SACK_PERM=1
957 327.596325 192.168.43.101 -> 75.98.172.238 TCP 66 49276 > http [SYN] Seq=0 Win=8192 Len=0 MSS=1460 WS=256 SACK_PERM=1
958 328.526592 192.168.43.101 -> 75.98.172.238 TCP 66 49277 > http [SYN] Seq=0 Win=8192 Len=0 MSS=1460 WS=256 SACK_PERM=1
959 331.536467 192.168.43.101 -> 75.98.172.238 TCP 66 49277 > http [SYN] Seq=0 Win=8192 Len=0 MSS=1460 WS=256 SACK_PERM=1
962 333.596464 192.168.43.101 -> 75.98.172.238 TCP 62 49276 > http [SYN] Seq=0 Win=8192 Len=0 MSS=1460 SACK_PERM=1
963 337.536603 192.168.43.101 -> 75.98.172.238 TCP 62 49277 > http [SYN] Seq=0 Win=8192 Len=0 MSS=1460 SACK_PERM=1
964 350.597845 192.168.43.101 -> 75.98.172.238 TCP 66 49278 > http [SYN] Seq=0 Win=8192 Len=0 MSS=1460 WS=256 SACK_PERM=1
965 353.597978 192.168.43.101 -> 75.98.172.238 TCP 66 49278 > http [SYN] Seq=0 Win=8192 Len=0 MSS=1460 WS=256 SACK_PERM=1
966 354.538163 192.168.43.101 -> 75.98.172.238 TCP 66 49279 > http [SYN] Seq=0 Win=8192 Len=0 MSS=1460 WS=256 SACK_PERM=1
967 357.538125 192.168.43.101 -> 75.98.172.238 TCP 66 49279 > http [SYN] Seq=0 Win=8192 Len=0 MSS=1460 WS=256 SACK_PERM=1
970 359.598135 192.168.43.101 -> 75.98.172.238 TCP 62 49278 > http [SYN] Seq=0 Win=8192 Len=0 MSS=1460 SACK_PERM=1
971 363.538286 192.168.43.101 -> 75.98.172.238 TCP 62 49279 > http [SYN] Seq=0 Win=8192 Len=0 MSS=1460 SACK_PERM=1
976 376.599714 192.168.43.101 -> 75.98.172.238 TCP 66 49280 > http [SYN] Seq=0 Win=8192 Len=0 MSS=1460 WS=256 SACK_PERM=1
978 379.599645 192.168.43.101 -> 75.98.172.238 TCP 66 49280 > http [SYN] Seq=0 Win=8192 Len=0 MSS=1460 WS=256 SACK_PERM=1
979 380.539804 192.168.43.101 -> 75.98.172.238 TCP 66 49281 > http [SYN] Seq=0 Win=8192 Len=0 MSS=1460 WS=256 SACK_PERM=1
980 383.539766 192.168.43.101 -> 75.98.172.238 TCP 66 49281 > http [SYN] Seq=0 Win=8192 Len=0 MSS=1460 WS=256 SACK_PERM=1
983 385.599799 192.168.43.101 -> 75.98.172.238 TCP 62 49280 > http [SYN] Seq=0 Win=8192 Len=0 MSS=1460 SACK_PERM=1
984 389.539937 192.168.43.101 -> 75.98.172.238 TCP 62 49281 > http [SYN] Seq=0 Win=8192 Len=0 MSS=1460 SACK_PERM=1
986 402.601207 192.168.43.101 -> 75.98.172.238 TCP 66 49282 > http [SYN] Seq=0 Win=8192 Len=0 MSS=1460 WS=256 SACK_PERM=1
987 405.601317 192.168.43.101 -> 75.98.172.238 TCP 66 49282 > http [SYN] Seq=0 Win=8192 Len=0 MSS=1460 WS=256 SACK_PERM=1
988 406.541435 192.168.43.101 -> 75.98.172.238 TCP 66 49283 > http [SYN] Seq=0 Win=8192 Len=0 MSS=1460 WS=256 SACK_PERM=1
991 409.541446 192.168.43.101 -> 75.98.172.238 TCP 66 49283 > http [SYN] Seq=0 Win=8192 Len=0 MSS=1460 WS=256 SACK_PERM=1
992 411.601476 192.168.43.101 -> 75.98.172.238 TCP 62 49282 > http [SYN] Seq=0 Win=8192 Len=0 MSS=1460 SACK_PERM=1
993 415.541604 192.168.43.101 -> 75.98.172.238 TCP 62 49283 > http [SYN] Seq=0 Win=8192 Len=0 MSS=1460 SACK_PERM=1
995 428.603138 192.168.43.101 -> 75.98.172.238 TCP 66 49284 > http [SYN] Seq=0 Win=8192 Len=0 MSS=1460 WS=256 SACK_PERM=1
996 431.602969 192.168.43.101 -> 75.98.172.238 TCP 66 49284 > http [SYN] Seq=0 Win=8192 Len=0 MSS=1460 WS=256 SACK_PERM=1
997 432.543114 192.168.43.101 -> 75.98.172.238 TCP 66 49285 > http [SYN] Seq=0 Win=8192 Len=0 MSS=1460 WS=256 SACK_PERM=1
1000 435.543116 192.168.43.101 -> 75.98.172.238 TCP 66 49285 > http [SYN] Seq=0 Win=8192 Len=0 MSS=1460 WS=256 SACK_PERM=1
1001 437.603131 192.168.43.101 -> 75.98.172.238 TCP 62 49284 > http [SYN] Seq=0 Win=8192 Len=0 MSS=1460 SACK_PERM=1
1002 441.543281 192.168.43.101 -> 75.98.172.238 TCP 62 49285 > http [SYN] Seq=0 Win=8192 Len=0 MSS=1460 SACK_PERM=1
1003 454.604734 192.168.43.101 -> 75.98.172.238 TCP 66 49286 > http [SYN] Seq=0 Win=8192 Len=0 MSS=1460 WS=256 SACK_PERM=1
1004 457.604645 192.168.43.101 -> 75.98.172.238 TCP 66 49286 > http [SYN] Seq=0 Win=8192 Len=0 MSS=1460 WS=256 SACK_PERM=1
1005 458.544847 192.168.43.101 -> 75.98.172.238 TCP 66 49287 > http [SYN] Seq=0 Win=8192 Len=0 MSS=1460 WS=256 SACK_PERM=1
1008 461.544764 192.168.43.101 -> 75.98.172.238 TCP 66 49287 > http [SYN] Seq=0 Win=8192 Len=0 MSS=1460 WS=256 SACK_PERM=1
1010 463.604795 192.168.43.101 -> 75.98.172.238 TCP 62 49286 > http [SYN] Seq=0 Win=8192 Len=0 MSS=1460 SACK_PERM=1
1011 467.544935 192.168.43.101 -> 75.98.172.238 TCP 62 49287 > http [SYN] Seq=0 Win=8192 Len=0 MSS=1460 SACK_PERM=1
1014 479.546465 192.168.43.101 -> 75.98.172.238 TCP 66 49288 > http [SYN] Seq=0 Win=8192 Len=0 MSS=1460 WS=256 SACK_PERM=1
1015 480.606359 192.168.43.101 -> 75.98.172.238 TCP 66 49289 > http [SYN] Seq=0 Win=8192 Len=0 MSS=1460 WS=256 SACK_PERM=1
1016 482.556273 192.168.43.101 -> 75.98.172.238 TCP 66 49288 > http [SYN] Seq=0 Win=8192 Len=0 MSS=1460 WS=256 SACK_PERM=1
1017 483.606353 192.168.43.101 -> 75.98.172.238 TCP 66 49289 > http [SYN] Seq=0 Win=8192 Len=0 MSS=1460 WS=256 SACK_PERM=1
1018 488.546440 192.168.43.101 -> 75.98.172.238 TCP 62 49288 > http [SYN] Seq=0 Win=8192 Len=0 MSS=1460 SACK_PERM=1
1019 489.606510 192.168.43.101 -> 75.98.172.238 TCP 62 49289 > http [SYN] Seq=0 Win=8192 Len=0 MSS=1460 SACK_PERM=1
1022 505.547970 192.168.43.101 -> 75.98.172.238 TCP 66 49290 > http [SYN] Seq=0 Win=8192 Len=0 MSS=1460 WS=256 SACK_PERM=1
1023 506.608072 192.168.43.101 -> 75.98.172.238 TCP 66 49291 > http [SYN] Seq=0 Win=8192 Len=0 MSS=1460 WS=256 SACK_PERM=1
1024 508.547931 192.168.43.101 -> 75.98.172.238 TCP 66 49290 > http [SYN] Seq=0 Win=8192 Len=0 MSS=1460 WS=256 SACK_PERM=1
1025 509.608007 192.168.43.101 -> 75.98.172.238 TCP 66 49291 > http [SYN] Seq=0 Win=8192 Len=0 MSS=1460 WS=256 SACK_PERM=1
1026 514.548112 192.168.43.101 -> 75.98.172.238 TCP 62 49290 > http [SYN] Seq=0 Win=8192 Len=0 MSS=1460 SACK_PERM=1
1027 515.608174 192.168.43.101 -> 75.98.172.238 TCP 62 49291 > http [SYN] Seq=0 Win=8192 Len=0 MSS=1460 SACK_PERM=1
1031 531.549661 192.168.43.101 -> 75.98.172.238 TCP 66 49292 > http [SYN] Seq=0 Win=8192 Len=0 MSS=1460 WS=256 SACK_PERM=1
1032 532.609741 192.168.43.101 -> 75.98.172.238 TCP 66 49293 > http [SYN] Seq=0 Win=8192 Len=0 MSS=1460 WS=256 SACK_PERM=1
1033 534.549615 192.168.43.101 -> 75.98.172.238 TCP 66 49292 > http [SYN] Seq=0 Win=8192 Len=0 MSS=1460 WS=256 SACK_PERM=1
1034 535.609687 192.168.43.101 -> 75.98.172.238 TCP 66 49293 > http [SYN] Seq=0 Win=8192 Len=0 MSS=1460 WS=256 SACK_PERM=1
1035 540.549759 192.168.43.101 -> 75.98.172.238 TCP 62 49292 > http [SYN] Seq=0 Win=8192 Len=0 MSS=1460 SACK_PERM=1
1036 541.609831 192.168.43.101 -> 75.98.172.238 TCP 62 49293 > http [SYN] Seq=0 Win=8192 Len=0 MSS=1460 SACK_PERM=1
1039 557.551389 192.168.43.101 -> 75.98.172.238 TCP 66 49294 > http [SYN] Seq=0 Win=8192 Len=0 MSS=1460 WS=256 SACK_PERM=1
1040 558.611395 192.168.43.101 -> 75.98.172.238 TCP 66 49295 > http [SYN] Seq=0 Win=8192 Len=0 MSS=1460 WS=256 SACK_PERM=1
1041 560.551277 192.168.43.101 -> 75.98.172.238 TCP 66 49294 > http [SYN] Seq=0 Win=8192 Len=0 MSS=1460 WS=256 SACK_PERM=1
1042 561.611209 192.168.43.101 -> 75.98.172.238 TCP 66 49295 > http [SYN] Seq=0 Win=8192 Len=0 MSS=1460 WS=256 SACK_PERM=1
1043 566.551404 192.168.43.101 -> 75.98.172.238 TCP 62 49294 > http [SYN] Seq=0 Win=8192 Len=0 MSS=1460 SACK_PERM=1
1044 567.611460 192.168.43.101 -> 75.98.172.238 TCP 62 49295 > http [SYN] Seq=0 Win=8192 Len=0 MSS=1460 SACK_PERM=1
1049 580.073587 192.168.43.101 -> 23.92.22.75  TCP 66 49296 > http [SYN] Seq=0 Win=8192 Len=0 MSS=1460 WS=256 SACK_PERM=1
1050 580.482304  23.92.22.75 -> 192.168.43.101 TCP 66 http > 49296 [SYN, ACK] Seq=0 Ack=1 Win=14600 Len=0 MSS=1400 SACK_PERM=1 WS=128
1063 582.019131 192.168.43.101 -> 81.169.145.153 TCP 66 49297 > http [SYN] Seq=0 Win=8192 Len=0 MSS=1460 WS=256 SACK_PERM=1
1064 582.325183 81.169.145.153 -> 192.168.43.101 TCP 66 http > 49297 [SYN, ACK] Seq=0 Ack=1 Win=4200 Len=0 MSS=1400 WS=1 SACK_PERM=1
1074 583.350420 192.168.43.101 -> 94.73.150.60 TCP 66 49298 > http [SYN] Seq=0 Win=8192 Len=0 MSS=1460 WS=256 SACK_PERM=1
1075 583.552949 192.168.43.101 -> 75.98.172.238 TCP 66 49299 > http [SYN] Seq=0 Win=8192 Len=0 MSS=1460 WS=256 SACK_PERM=1
1076 583.740412 94.73.150.60 -> 192.168.43.101 TCP 58 http > 49298 [SYN, ACK] Seq=0 Ack=1 Win=8190 Len=0 MSS=1360
1148 586.552942 192.168.43.101 -> 75.98.172.238 TCP 66 49299 > http [SYN] Seq=0 Win=8192 Len=0 MSS=1460 WS=256 SACK_PERM=1
1424 591.101836 192.168.43.101 -> 195.110.124.133 TCP 66 49300 > http [SYN] Seq=0 Win=8192 Len=0 MSS=1460 WS=256 SACK_PERM=1
1425 591.438588 195.110.124.133 -> 192.168.43.101 TCP 62 http > 49300 [SYN, ACK] Seq=0 Ack=1 Win=14600 Len=0 MSS=1400 SACK_PERM=1
1433 591.854674 192.168.43.101 -> 195.110.124.133 TCP 66 49301 > http [SYN] Seq=0 Win=8192 Len=0 MSS=1460 WS=256 SACK_PERM=1
1434 592.258086 195.110.124.133 -> 192.168.43.101 TCP 62 http > 49301 [SYN, ACK] Seq=0 Ack=1 Win=14600 Len=0 MSS=1400 SACK_PERM=1
1438 592.553022 192.168.43.101 -> 75.98.172.238 TCP 62 49299 > http [SYN] Seq=0 Win=8192 Len=0 MSS=1460 SACK_PERM=1
1449 593.282775 192.168.43.101 -> 50.87.151.232 TCP 66 49302 > http [SYN] Seq=0 Win=8192 Len=0 MSS=1460 WS=256 SACK_PERM=1
1450 593.691139 50.87.151.232 -> 192.168.43.101 TCP 66 http > 49302 [SYN, ACK] Seq=0 Ack=1 Win=14600 Len=0 MSS=1400 SACK_PERM=1 WS=128
1487 594.655556 192.168.43.101 -> 122.178.225.8 TCP 66 49303 > http [SYN] Seq=0 Win=8192 Len=0 MSS=1460 WS=256 SACK_PERM=1
1489 595.124882 122.178.225.8 -> 192.168.43.101 TCP 66 http > 49303 [SYN, ACK] Seq=0 Ack=1 Win=14600 Len=0 MSS=1400 SACK_PERM=1 WS=2
1491 595.125181 122.178.225.8 -> 192.168.43.101 TCP 66 http > 49303 [SYN, ACK] Seq=0 Ack=1 Win=14600 Len=0 MSS=1400 SACK_PERM=1 WS=2
1845 602.498403 192.168.43.101 -> 69.89.31.82  TCP 66 49304 > http [SYN] Seq=0 Win=8192 Len=0 MSS=1460 WS=256 SACK_PERM=1
1846 603.009547  69.89.31.82 -> 192.168.43.101 TCP 66 http > 49304 [SYN, ACK] Seq=0 Ack=1 Win=5840 Len=0 MSS=1400 SACK_PERM=1 WS=128
2177 609.556770 192.168.43.101 -> 75.98.172.238 TCP 66 49305 > http [SYN] Seq=0 Win=8192 Len=0 MSS=1460 WS=256 SACK_PERM=1
2179 612.556668 192.168.43.101 -> 75.98.172.238 TCP 66 49305 > http [SYN] Seq=0 Win=8192 Len=0 MSS=1460 WS=256 SACK_PERM=1
2180 618.556798 192.168.43.101 -> 75.98.172.238 TCP 62 49305 > http [SYN] Seq=0 Win=8192 Len=0 MSS=1460 SACK_PERM=1
2184 625.752375 192.168.43.101 -> 199.7.51.72  TCP 66 49306 > http [SYN] Seq=0 Win=8192 Len=0 MSS=1460 WS=256 SACK_PERM=1
2185 626.151025  199.7.51.72 -> 192.168.43.101 TCP 58 http > 49306 [SYN, ACK] Seq=0 Ack=1 Win=8190 Len=0 MSS=1360
2198 626.711609 192.168.43.101 -> 122.178.225.40 TCP 66 49307 > http [SYN] Seq=0 Win=8192 Len=0 MSS=1460 WS=256 SACK_PERM=1
2199 626.768438 122.178.225.40 -> 192.168.43.101 TCP 66 http > 49307 [SYN, ACK] Seq=0 Ack=1 Win=14600 Len=0 MSS=1400 SACK_PERM=1 WS=2
2208 627.001429 192.168.43.101 -> 23.35.5.163  TCP 62 49308 > http [SYN] Seq=0 Win=8192 Len=0 MSS=1460 SACK_PERM=1
2209 627.078629  23.35.5.163 -> 192.168.43.101 TCP 62 http > 49308 [SYN, ACK] Seq=0 Ack=1 Win=14600 Len=0 MSS=1400 SACK_PERM=1
2248 627.521563 192.168.43.101 -> 23.35.5.163  TCP 62 49309 > http [SYN] Seq=0 Win=8192 Len=0 MSS=1460 SACK_PERM=1
2249 627.608896  23.35.5.163 -> 192.168.43.101 TCP 62 http > 49309 [SYN, ACK] Seq=0 Ack=1 Win=14600 Len=0 MSS=1400 SACK_PERM=1
2256 627.881442 192.168.43.101 -> 199.7.51.72  TCP 66 49310 > http [SYN] Seq=0 Win=8192 Len=0 MSS=1460 WS=256 SACK_PERM=1
2258 628.301455  199.7.51.72 -> 192.168.43.101 TCP 58 http > 49310 [SYN, ACK] Seq=0 Ack=1 Win=8190 Len=0 MSS=1360
2270 628.832805 192.168.43.101 -> 117.18.237.29 TCP 66 49311 > http [SYN] Seq=0 Win=8192 Len=0 MSS=1460 WS=256 SACK_PERM=1
2271 628.918979 117.18.237.29 -> 192.168.43.101 TCP 66 http > 49311 [SYN, ACK] Seq=0 Ack=1 Win=14600 Len=0 MSS=1400 SACK_PERM=1 WS=64
2280 629.251627 192.168.43.101 -> 199.7.51.72  TCP 66 49312 > http [SYN] Seq=0 Win=8192 Len=0 MSS=1460 WS=256 SACK_PERM=1
2284 629.632494  199.7.51.72 -> 192.168.43.101 TCP 58 http > 49312 [SYN, ACK] Seq=0 Ack=1 Win=8190 Len=0 MSS=1360
2296 630.271227 192.168.43.101 -> 199.7.51.72  TCP 66 49313 > http [SYN] Seq=0 Win=8192 Len=0 MSS=1460 WS=256 SACK_PERM=1
2299 630.619457  199.7.51.72 -> 192.168.43.101 TCP 58 http > 49313 [SYN, ACK] Seq=0 Ack=1 Win=8190 Len=0 MSS=1360
2311 631.135783 192.168.43.101 -> 199.7.51.72  TCP 66 49314 > http [SYN] Seq=0 Win=8192 Len=0 MSS=1460 WS=256 SACK_PERM=1
2314 631.478101  199.7.51.72 -> 192.168.43.101 TCP 58 http > 49314 [SYN, ACK] Seq=0 Ack=1 Win=8190 Len=0 MSS=1360
2324 632.060133 192.168.43.101 -> 199.7.51.72  TCP 66 49315 > http [SYN] Seq=0 Win=8192 Len=0 MSS=1460 WS=256 SACK_PERM=1
2327 632.418132  199.7.51.72 -> 192.168.43.101 TCP 58 http > 49315 [SYN, ACK] Seq=0 Ack=1 Win=8190 Len=0 MSS=1360
2339 633.021181 192.168.43.101 -> 74.125.135.138 TCP 66 49316 > http [SYN] Seq=0 Win=8192 Len=0 MSS=1460 WS=256 SACK_PERM=1
2340 633.118134 74.125.135.138 -> 192.168.43.101 TCP 66 http > 49316 [SYN, ACK] Seq=0 Ack=1 Win=42900 Len=0 MSS=1400 SACK_PERM=1 WS=64
2347 633.320008 192.168.43.101 -> 199.7.51.72  TCP 66 49317 > http [SYN] Seq=0 Win=8192 Len=0 MSS=1460 WS=256 SACK_PERM=1
2349 633.728403  199.7.51.72 -> 192.168.43.101 TCP 58 http > 49317 [SYN, ACK] Seq=0 Ack=1 Win=8190 Len=0 MSS=1360
2359 634.194296 192.168.43.101 -> 199.7.51.72  TCP 66 49318 > http [SYN] Seq=0 Win=8192 Len=0 MSS=1460 WS=256 SACK_PERM=1
2365 634.552177  199.7.51.72 -> 192.168.43.101 TCP 58 http > 49318 [SYN, ACK] Seq=0 Ack=1 Win=8190 Len=0 MSS=1360
2378 635.079008 192.168.43.101 -> 199.7.51.72  TCP 66 49319 > http [SYN] Seq=0 Win=8192 Len=0 MSS=1460 WS=256 SACK_PERM=1
2383 635.417890  199.7.51.72 -> 192.168.43.101 TCP 58 http > 49319 [SYN, ACK] Seq=0 Ack=1 Win=8190 Len=0 MSS=1360
2391 635.451796 192.168.43.101 -> 217.35.75.232 TCP 66 49320 > 8956 [SYN] Seq=0 Win=8192 Len=0 MSS=1460 WS=256 SACK_PERM=1
2392 635.558263 192.168.43.101 -> 75.98.172.238 TCP 66 49321 > http [SYN] Seq=0 Win=8192 Len=0 MSS=1460 WS=256 SACK_PERM=1
2403 636.010631 192.168.43.101 -> 178.255.83.1 TCP 66 49322 > http [SYN] Seq=0 Win=8192 Len=0 MSS=1460 WS=256 SACK_PERM=1
2404 636.288441 178.255.83.1 -> 192.168.43.101 TCP 66 http > 49322 [SYN, ACK] Seq=0 Ack=1 Win=5840 Len=0 MSS=1400 SACK_PERM=1 WS=256
2417 636.729839 192.168.43.101 -> 182.50.136.239 TCP 66 49323 > http [SYN] Seq=0 Win=8192 Len=0 MSS=1460 WS=256 SACK_PERM=1
2418 636.818722 182.50.136.239 -> 192.168.43.101 TCP 66 http > 49323 [SYN, ACK] Seq=0 Ack=1 Win=5840 Len=0 MSS=1400 SACK_PERM=1 WS=128
2432 637.231044 192.168.43.101 -> 199.7.71.72  TCP 66 49324 > http [SYN] Seq=0 Win=8192 Len=0 MSS=1460 WS=256 SACK_PERM=1
2433 637.516978  199.7.71.72 -> 192.168.43.101 TCP 58 http > 49324 [SYN, ACK] Seq=0 Ack=1 Win=8190 Len=0 MSS=1360
2443 637.881593 192.168.43.101 -> 117.18.237.29 TCP 66 49325 > http [SYN] Seq=0 Win=8192 Len=0 MSS=1460 WS=256 SACK_PERM=1
2444 637.978266 117.18.237.29 -> 192.168.43.101 TCP 66 http > 49325 [SYN, ACK] Seq=0 Ack=1 Win=14600 Len=0 MSS=1400 SACK_PERM=1 WS=64
2452 638.451233 192.168.43.101 -> 217.35.75.232 TCP 66 49320 > 8956 [SYN] Seq=0 Win=8192 Len=0 MSS=1460 WS=256 SACK_PERM=1
2455 638.559220 192.168.43.101 -> 75.98.172.238 TCP 66 49321 > http [SYN] Seq=0 Win=8192 Len=0 MSS=1460 WS=256 SACK_PERM=1
2463 644.451460 192.168.43.101 -> 217.35.75.232 TCP 62 49320 > 8956 [SYN] Seq=0 Win=8192 Len=0 MSS=1460 SACK_PERM=1
2464 644.559381 192.168.43.101 -> 75.98.172.238 TCP 62 49321 > http [SYN] Seq=0 Win=8192 Len=0 MSS=1460 SACK_PERM=1
2472 656.269123 192.168.43.101 -> 95.104.30.151 TCP 66 49326 > 6863 [SYN] Seq=0 Win=8192 Len=0 MSS=1460 WS=256 SACK_PERM=1
2473 659.268855 192.168.43.101 -> 95.104.30.151 TCP 66 49326 > 6863 [SYN] Seq=0 Win=8192 Len=0 MSS=1460 WS=256 SACK_PERM=1
2482 660.662151 192.168.43.101 -> 107.193.222.108 TCP 66 49327 > 6686 [SYN] Seq=0 Win=8192 Len=0 MSS=1460 WS=256 SACK_PERM=1
2484 661.561015 192.168.43.101 -> 75.98.172.238 TCP 66 49328 > http [SYN] Seq=0 Win=8192 Len=0 MSS=1460 WS=256 SACK_PERM=1
2485 663.661891 192.168.43.101 -> 107.193.222.108 TCP 66 49327 > 6686 [SYN] Seq=0 Win=8192 Len=0 MSS=1460 WS=256 SACK_PERM=1
2488 664.560962 192.168.43.101 -> 75.98.172.238 TCP 66 49328 > http [SYN] Seq=0 Win=8192 Len=0 MSS=1460 WS=256 SACK_PERM=1
2489 665.268979 192.168.43.101 -> 95.104.30.151 TCP 62 49326 > 6863 [SYN] Seq=0 Win=8192 Len=0 MSS=1460 SACK_PERM=1
2491 669.662071 192.168.43.101 -> 107.193.222.108 TCP 62 49327 > 6686 [SYN] Seq=0 Win=8192 Len=0 MSS=1460 SACK_PERM=1
2492 670.561131 192.168.43.101 -> 75.98.172.238 TCP 62 49328 > http [SYN] Seq=0 Win=8192 Len=0 MSS=1460 SACK_PERM=1
2495 671.441964 192.168.43.101 -> 74.125.128.103 TCP 66 49329 > http [SYN] Seq=0 Win=8192 Len=0 MSS=1460 WS=4 SACK_PERM=1
2496 671.587048 74.125.128.103 -> 192.168.43.101 TCP 66 http > 49329 [SYN, ACK] Seq=0 Ack=1 Win=42900 Len=0 MSS=1400 SACK_PERM=1 WS=64
2507 671.858905 192.168.43.101 -> 173.194.127.87 TCP 66 49330 > http [SYN] Seq=0 Win=8192 Len=0 MSS=1460 WS=4 SACK_PERM=1
2509 671.987384 173.194.127.87 -> 192.168.43.101 TCP 66 http > 49330 [SYN, ACK] Seq=0 Ack=1 Win=62920 Len=0 MSS=1400 SACK_PERM=1 WS=64
2518 672.311529 192.168.43.101 -> 173.194.127.87 TCP 66 49331 > https [SYN] Seq=0 Win=8192 Len=0 MSS=1460 WS=4 SACK_PERM=1
2520 672.428086 173.194.127.87 -> 192.168.43.101 TCP 66 https > 49331 [SYN, ACK] Seq=0 Ack=1 Win=42900 Len=0 MSS=1400 SACK_PERM=1 WS=64
2533 673.051320 192.168.43.101 -> 23.35.5.163  TCP 62 49332 > http [SYN] Seq=0 Win=8192 Len=0 MSS=1460 SACK_PERM=1
2534 673.138224  23.35.5.163 -> 192.168.43.101 TCP 62 http > 49332 [SYN, ACK] Seq=0 Ack=1 Win=14600 Len=0 MSS=1400 SACK_PERM=1
2541 673.448189 192.168.43.101 -> 74.125.135.138 TCP 66 49333 > http [SYN] Seq=0 Win=8192 Len=0 MSS=1460 WS=256 SACK_PERM=1
2542 673.547007 74.125.135.138 -> 192.168.43.101 TCP 66 http > 49333 [SYN, ACK] Seq=0 Ack=1 Win=42900 Len=0 MSS=1400 SACK_PERM=1 WS=64
2582 674.485906 192.168.43.101 -> 95.104.30.151 TCP 66 49334 > 6863 [SYN] Seq=0 Win=8192 Len=0 MSS=1460 WS=256 SACK_PERM=1
2594 677.485301 192.168.43.101 -> 95.104.30.151 TCP 66 49334 > 6863 [SYN] Seq=0 Win=8192 Len=0 MSS=1460 WS=256 SACK_PERM=1
2595 683.485463 192.168.43.101 -> 95.104.30.151 TCP 62 49334 > 6863 [SYN] Seq=0 Win=8192 Len=0 MSS=1460 SACK_PERM=1
2597 687.562664 192.168.43.101 -> 75.98.172.238 TCP 66 49335 > http [SYN] Seq=0 Win=8192 Len=0 MSS=1460 WS=256 SACK_PERM=1
2598 690.562606 192.168.43.101 -> 75.98.172.238 TCP 66 49335 > http [SYN] Seq=0 Win=8192 Len=0 MSS=1460 WS=256 SACK_PERM=1
2607 694.042664 192.168.43.101 -> 69.115.119.227 TCP 66 49336 > isoipsigport-1 [SYN] Seq=0 Win=8192 Len=0 MSS=1460 WS=256 SACK_PERM=1
2609 694.449614 69.115.119.227 -> 192.168.43.101 TCP 66 isoipsigport-1 > 49336 [SYN, ACK] Seq=0 Ack=1 Win=65535 Len=0 MSS=1400 WS=1 SACK_PERM=1
2644 696.560747 192.168.43.101 -> 75.98.172.238 TCP 62 49335 > http [SYN] Seq=0 Win=8192 Len=0 MSS=1460 SACK_PERM=1
2876 703.968682 192.168.43.101 -> 199.7.55.72  TCP 66 49337 > http [SYN] Seq=0 Win=8192 Len=0 MSS=1460 WS=256 SACK_PERM=1
2877 704.279749  199.7.55.72 -> 192.168.43.101 TCP 58 http > 49337 [SYN, ACK] Seq=0 Ack=1 Win=8190 Len=0 MSS=1360
2913 704.818026 192.168.43.101 -> 23.35.5.163  TCP 62 49338 > http [SYN] Seq=0 Win=8192 Len=0 MSS=1460 SACK_PERM=1
2914 704.886429  23.35.5.163 -> 192.168.43.101 TCP 62 http > 49338 [SYN, ACK] Seq=0 Ack=1 Win=14600 Len=0 MSS=1400 SACK_PERM=1
3365 713.560399 192.168.43.101 -> 75.98.172.238 TCP 66 49339 > http [SYN] Seq=0 Win=8192 Len=0 MSS=1460 WS=256 SACK_PERM=1
3462 716.565186 192.168.43.101 -> 75.98.172.238 TCP 66 49339 > http [SYN] Seq=0 Win=8192 Len=0 MSS=1460 WS=256 SACK_PERM=1
3569 722.558426 192.168.43.101 -> 75.98.172.238 TCP 62 49339 > http [SYN] Seq=0 Win=8192 Len=0 MSS=1460 SACK_PERM=1
3577 726.707504 192.168.43.101 -> 99.188.227.246 TCP 66 49340 > 4561 [SYN] Seq=0 Win=8192 Len=0 MSS=1460 WS=256 SACK_PERM=1
3584 729.707647 192.168.43.101 -> 99.188.227.246 TCP 66 49340 > 4561 [SYN] Seq=0 Win=8192 Len=0 MSS=1460 WS=256 SACK_PERM=1
3589 735.707807 192.168.43.101 -> 99.188.227.246 TCP 62 49340 > 4561 [SYN] Seq=0 Win=8192 Len=0 MSS=1460 SACK_PERM=1
3595 739.592980 192.168.43.101 -> 75.98.172.238 TCP 66 49341 > http [SYN] Seq=0 Win=8192 Len=0 MSS=1460 WS=256 SACK_PERM=1
3596 742.592935 192.168.43.101 -> 75.98.172.238 TCP 66 49341 > http [SYN] Seq=0 Win=8192 Len=0 MSS=1460 WS=256 SACK_PERM=1
3598 748.593091 192.168.43.101 -> 75.98.172.238 TCP 62 49341 > http [SYN] Seq=0 Win=8192 Len=0 MSS=1460 SACK_PERM=1
3603 754.764488 192.168.43.101 -> 99.123.8.127 TCP 66 49342 > 6221 [SYN] Seq=0 Win=8192 Len=0 MSS=1460 WS=256 SACK_PERM=1
3613 757.764379 192.168.43.101 -> 99.123.8.127 TCP 66 49342 > 6221 [SYN] Seq=0 Win=8192 Len=0 MSS=1460 WS=256 SACK_PERM=1
3616 760.594489 192.168.43.101 -> 23.92.22.75  TCP 66 49343 > http [SYN] Seq=0 Win=8192 Len=0 MSS=1460 WS=256 SACK_PERM=1
3617 761.007343  23.92.22.75 -> 192.168.43.101 TCP 66 http > 49343 [SYN, ACK] Seq=0 Ack=1 Win=14600 Len=0 MSS=1400 SACK_PERM=1 WS=128
3627 762.139822 192.168.43.101 -> 81.169.145.153 TCP 66 49344 > http [SYN] Seq=0 Win=8192 Len=0 MSS=1460 WS=256 SACK_PERM=1
3628 762.441028 81.169.145.153 -> 192.168.43.101 TCP 66 http > 49344 [SYN, ACK] Seq=0 Ack=1 Win=4200 Len=0 MSS=1400 WS=1 SACK_PERM=1
3636 762.757700 192.168.43.101 -> 94.73.150.60 TCP 66 49345 > http [SYN] Seq=0 Win=8192 Len=0 MSS=1460 WS=256 SACK_PERM=1
3638 763.155512 94.73.150.60 -> 192.168.43.101 TCP 58 http > 49345 [SYN, ACK] Seq=0 Ack=1 Win=8190 Len=0 MSS=1360
3657 763.757497 192.168.43.101 -> 99.123.8.127 TCP 62 49342 > 6221 [SYN] Seq=0 Win=8192 Len=0 MSS=1460 SACK_PERM=1
3979 769.451159 192.168.43.101 -> 195.110.124.133 TCP 66 49346 > http [SYN] Seq=0 Win=8192 Len=0 MSS=1460 WS=256 SACK_PERM=1
3981 769.723300 195.110.124.133 -> 192.168.43.101 TCP 62 http > 49346 [SYN, ACK] Seq=0 Ack=1 Win=14600 Len=0 MSS=1400 SACK_PERM=1
3990 770.381077 192.168.43.101 -> 195.110.124.133 TCP 66 49347 > http [SYN] Seq=0 Win=8192 Len=0 MSS=1460 WS=256 SACK_PERM=1
3992 770.737070 195.110.124.133 -> 192.168.43.101 TCP 62 http > 49347 [SYN, ACK] Seq=0 Ack=1 Win=14600 Len=0 MSS=1400 SACK_PERM=1
4003 771.153367 192.168.43.101 -> 50.87.151.232 TCP 66 49348 > http [SYN] Seq=0 Win=8192 Len=0 MSS=1460 WS=256 SACK_PERM=1
4005 771.493325 50.87.151.232 -> 192.168.43.101 TCP 66 http > 49348 [SYN, ACK] Seq=0 Ack=1 Win=14600 Len=0 MSS=1400 SACK_PERM=1 WS=128
4379 777.040283 192.168.43.101 -> 69.89.31.82  TCP 66 49349 > http [SYN] Seq=0 Win=8192 Len=0 MSS=1460 WS=256 SACK_PERM=1
4382 777.373283  69.89.31.82 -> 192.168.43.101 TCP 66 http > 49349 [SYN, ACK] Seq=0 Ack=1 Win=5840 Len=0 MSS=1400 SACK_PERM=1 WS=128
4720 793.980399 192.168.43.101 -> 31.197.209.67 TCP 66 49350 > altcp [SYN] Seq=0 Win=8192 Len=0 MSS=1460 WS=256 SACK_PERM=1
4723 796.980192 192.168.43.101 -> 31.197.209.67 TCP 66 49350 > altcp [SYN] Seq=0 Win=8192 Len=0 MSS=1460 WS=256 SACK_PERM=1
4726 802.980346 192.168.43.101 -> 31.197.209.67 TCP 62 49350 > altcp [SYN] Seq=0 Win=8192 Len=0 MSS=1460 SACK_PERM=1
4747 826.849116 192.168.43.101 -> 99.33.165.43 TCP 66 49351 > faximum [SYN] Seq=0 Win=8192 Len=0 MSS=1460 WS=256 SACK_PERM=1
4753 827.756993 192.168.43.101 -> 99.33.165.43 TCP 66 49351 > faximum [SYN] Seq=0 Win=8192 Len=0 MSS=1460 WS=256 SACK_PERM=1
4758 828.679014 192.168.43.101 -> 99.33.165.43 TCP 62 49351 > faximum [SYN] Seq=0 Win=8192 Len=0 MSS=1460 SACK_PERM=1
4786 898.731337 192.168.43.101 -> 82.51.144.219 TCP 66 49352 > 9703 [SYN] Seq=0 Win=8192 Len=0 MSS=1460 WS=256 SACK_PERM=1
4788 899.037664 82.51.144.219 -> 192.168.43.101 TCP 66 9703 > 49352 [SYN, ACK] Seq=0 Ack=1 Win=65535 Len=0 MSS=1400 WS=1 SACK_PERM=1
5328 989.477117 192.168.43.101 -> 176.73.148.62 TCP 66 49353 > dlpx-sp [SYN] Seq=0 Win=8192 Len=0 MSS=1460 WS=256 SACK_PERM=1
5329 989.863913 176.73.148.62 -> 192.168.43.101 TCP 66 dlpx-sp > 49353 [SYN, ACK] Seq=0 Ack=1 Win=65535 Len=0 MSS=1400 WS=1 SACK_PERM=1
5392 1133.801877 192.168.43.101 -> 207.46.61.29 TCP 66 49354 > http [SYN] Seq=0 Win=8192 Len=0 MSS=1460 WS=4 SACK_PERM=1
5393 1133.901065 207.46.61.29 -> 192.168.43.101 TCP 66 http > 49354 [SYN, ACK] Seq=0 Ack=1 Win=8192 Len=0 MSS=1400 WS=256 SACK_PERM=1
5396 1133.972008 192.168.43.101 -> 184.84.106.156 TCP 66 49355 > http [SYN] Seq=0 Win=8192 Len=0 MSS=1460 WS=4 SACK_PERM=1
5397 1133.978002 192.168.43.101 -> 184.84.106.156 TCP 66 49356 > http [SYN] Seq=0 Win=8192 Len=0 MSS=1460 WS=4 SACK_PERM=1
5398 1133.989225 192.168.43.101 -> 184.84.106.156 TCP 66 49357 > http [SYN] Seq=0 Win=8192 Len=0 MSS=1460 WS=4 SACK_PERM=1
5399 1133.995382 192.168.43.101 -> 184.84.106.156 TCP 66 49358 > http [SYN] Seq=0 Win=8192 Len=0 MSS=1460 WS=4 SACK_PERM=1
5401 1134.002199 192.168.43.101 -> 184.84.106.156 TCP 66 49359 > http [SYN] Seq=0 Win=8192 Len=0 MSS=1460 WS=4 SACK_PERM=1
5402 1134.051725 184.84.106.156 -> 192.168.43.101 TCP 66 http > 49355 [SYN, ACK] Seq=0 Ack=1 Win=14600 Len=0 MSS=1400 SACK_PERM=1 WS=2
5405 1134.052352 184.84.106.156 -> 192.168.43.101 TCP 66 http > 49356 [SYN, ACK] Seq=0 Ack=1 Win=14600 Len=0 MSS=1400 SACK_PERM=1 WS=2
5408 1134.054581 184.84.106.156 -> 192.168.43.101 TCP 66 http > 49357 [SYN, ACK] Seq=0 Ack=1 Win=14600 Len=0 MSS=1400 SACK_PERM=1 WS=2
5411 1134.057673 184.84.106.156 -> 192.168.43.101 TCP 66 http > 49358 [SYN, ACK] Seq=0 Ack=1 Win=14600 Len=0 MSS=1400 SACK_PERM=1 WS=2
5414 1134.061572 184.84.106.156 -> 192.168.43.101 TCP 66 http > 49359 [SYN, ACK] Seq=0 Ack=1 Win=14600 Len=0 MSS=1400 SACK_PERM=1 WS=2
5428 1134.187187 192.168.43.101 -> 207.46.49.132 TCP 66 49360 > http [SYN] Seq=0 Win=8192 Len=0 MSS=1460 WS=4 SACK_PERM=1
5446 1134.250955 192.168.43.101 -> 207.46.61.31 TCP 66 49361 > http [SYN] Seq=0 Win=8192 Len=0 MSS=1460 WS=4 SACK_PERM=1
5533 1134.602966 207.46.49.132 -> 192.168.43.101 TCP 58 http > 49360 [SYN, ACK] Seq=0 Ack=1 Win=8190 Len=0 MSS=1360
5542 1134.624260 207.46.61.31 -> 192.168.43.101 TCP 66 http > 49361 [SYN, ACK] Seq=0 Ack=1 Win=4200 Len=0 MSS=1400 WS=1 SACK_PERM=1
5613 1135.053514 192.168.43.101 -> 131.253.61.80 TCP 66 49362 > https [SYN] Seq=0 Win=8192 Len=0 MSS=1460 WS=4 SACK_PERM=1
5624 1135.124080 192.168.43.101 -> 184.84.111.139 TCP 66 49363 > http [SYN] Seq=0 Win=8192 Len=0 MSS=1460 WS=4 SACK_PERM=1
5625 1135.124564 192.168.43.101 -> 23.35.1.224  TCP 66 49364 > http [SYN] Seq=0 Win=8192 Len=0 MSS=1460 WS=4 SACK_PERM=1
5643 1135.361634 184.84.111.139 -> 192.168.43.101 TCP 66 http > 49363 [SYN, ACK] Seq=0 Ack=1 Win=14600 Len=0 MSS=1400 SACK_PERM=1 WS=2
5645 1135.361666  23.35.1.224 -> 192.168.43.101 TCP 66 http > 49364 [SYN, ACK] Seq=0 Ack=1 Win=14600 Len=0 MSS=1400 SACK_PERM=1 WS=2
5648 1135.362115 131.253.61.80 -> 192.168.43.101 TCP 58 https > 49362 [SYN, ACK] Seq=0 Ack=1 Win=4380 Len=0 MSS=1400
5696 1212.729555 192.168.43.101 -> 74.125.128.94 TCP 66 49365 > https [SYN] Seq=0 Win=8192 Len=0 MSS=1460 WS=256 SACK_PERM=1
5697 1212.855240 192.168.43.101 -> 74.125.128.94 TCP 66 49366 > https [SYN] Seq=0 Win=8192 Len=0 MSS=1460 WS=256 SACK_PERM=1
5698 1212.868123 74.125.128.94 -> 192.168.43.101 TCP 66 https > 49365 [SYN, ACK] Seq=0 Ack=1 Win=42900 Len=0 MSS=1400 SACK_PERM=1 WS=64
5701 1212.917322 192.168.43.101 -> 74.125.128.94 TCP 66 49367 > https [SYN] Seq=0 Win=8192 Len=0 MSS=1460 WS=256 SACK_PERM=1
5702 1212.988661 192.168.43.101 -> 74.125.128.94 TCP 66 49368 > https [SYN] Seq=0 Win=8192 Len=0 MSS=1460 WS=256 SACK_PERM=1
5703 1213.038103 74.125.128.94 -> 192.168.43.101 TCP 66 https > 49366 [SYN, ACK] Seq=0 Ack=1 Win=42900 Len=0 MSS=1400 SACK_PERM=1 WS=64
5707 1213.060150 74.125.128.94 -> 192.168.43.101 TCP 66 https > 49367 [SYN, ACK] Seq=0 Ack=1 Win=42900 Len=0 MSS=1400 SACK_PERM=1 WS=64
5717 1213.108019 74.125.128.94 -> 192.168.43.101 TCP 66 https > 49368 [SYN, ACK] Seq=0 Ack=1 Win=42900 Len=0 MSS=1400 SACK_PERM=1 WS=64
5756 1214.300872 192.168.43.101 -> 74.125.128.106 TCP 66 49369 > http [SYN] Seq=0 Win=8192 Len=0 MSS=1460 WS=256 SACK_PERM=1
5757 1214.438291 74.125.128.106 -> 192.168.43.101 TCP 66 http > 49369 [SYN, ACK] Seq=0 Ack=1 Win=42900 Len=0 MSS=1400 SACK_PERM=1 WS=64
5762 1214.730796 192.168.43.101 -> 74.125.128.94 TCP 66 49370 > http [SYN] Seq=0 Win=8192 Len=0 MSS=1460 WS=256 SACK_PERM=1
5764 1214.731438 192.168.43.101 -> 74.125.128.94 TCP 66 49371 > http [SYN] Seq=0 Win=8192 Len=0 MSS=1460 WS=256 SACK_PERM=1
5765 1214.731700 192.168.43.101 -> 74.125.128.94 TCP 66 49372 > http [SYN] Seq=0 Win=8192 Len=0 MSS=1460 WS=256 SACK_PERM=1
5766 1214.731960 192.168.43.101 -> 74.125.128.94 TCP 66 49373 > http [SYN] Seq=0 Win=8192 Len=0 MSS=1460 WS=256 SACK_PERM=1
5767 1214.732363 192.168.43.101 -> 74.125.128.106 TCP 66 49374 > http [SYN] Seq=0 Win=8192 Len=0 MSS=1460 WS=256 SACK_PERM=1
5768 1214.732617 192.168.43.101 -> 74.125.128.106 TCP 66 49375 > http [SYN] Seq=0 Win=8192 Len=0 MSS=1460 WS=256 SACK_PERM=1
5770 1214.849474 192.168.43.101 -> 74.125.135.120 TCP 66 49376 > http [SYN] Seq=0 Win=8192 Len=0 MSS=1460 WS=256 SACK_PERM=1
5771 1214.849704 192.168.43.101 -> 74.125.135.120 TCP 66 49377 > http [SYN] Seq=0 Win=8192 Len=0 MSS=1460 WS=256 SACK_PERM=1
5772 1214.849913 192.168.43.101 -> 74.125.135.120 TCP 66 49378 > http [SYN] Seq=0 Win=8192 Len=0 MSS=1460 WS=256 SACK_PERM=1
5773 1214.868111 74.125.128.94 -> 192.168.43.101 TCP 66 http > 49370 [SYN, ACK] Seq=0 Ack=1 Win=42900 Len=0 MSS=1400 SACK_PERM=1 WS=64
5776 1214.878078 74.125.128.94 -> 192.168.43.101 TCP 66 http > 49371 [SYN, ACK] Seq=0 Ack=1 Win=42900 Len=0 MSS=1400 SACK_PERM=1 WS=64
5778 1214.888251 74.125.128.94 -> 192.168.43.101 TCP 66 http > 49372 [SYN, ACK] Seq=0 Ack=1 Win=42900 Len=0 MSS=1400 SACK_PERM=1 WS=64
5780 1214.898064 74.125.128.94 -> 192.168.43.101 TCP 66 http > 49373 [SYN, ACK] Seq=0 Ack=1 Win=42900 Len=0 MSS=1400 SACK_PERM=1 WS=64
5782 1214.908683 74.125.128.106 -> 192.168.43.101 TCP 66 http > 49375 [SYN, ACK] Seq=0 Ack=1 Win=42900 Len=0 MSS=1400 SACK_PERM=1 WS=64
5784 1214.909273 74.125.128.106 -> 192.168.43.101 TCP 66 http > 49374 [SYN, ACK] Seq=0 Ack=1 Win=42900 Len=0 MSS=1400 SACK_PERM=1 WS=64
5787 1214.958606 74.125.135.120 -> 192.168.43.101 TCP 66 http > 49377 [SYN, ACK] Seq=0 Ack=1 Win=42900 Len=0 MSS=1400 SACK_PERM=1 WS=64
5789 1214.959235 74.125.135.120 -> 192.168.43.101 TCP 66 http > 49376 [SYN, ACK] Seq=0 Ack=1 Win=42900 Len=0 MSS=1400 SACK_PERM=1 WS=64
5791 1214.968430 74.125.135.120 -> 192.168.43.101 TCP 66 http > 49378 [SYN, ACK] Seq=0 Ack=1 Win=42900 Len=0 MSS=1400 SACK_PERM=1 WS=64
5797 1215.071187 192.168.43.101 -> 74.125.135.120 TCP 66 49379 > https [SYN] Seq=0 Win=8192 Len=0 MSS=1460 WS=256 SACK_PERM=1
5798 1215.071660 192.168.43.101 -> 74.125.128.106 TCP 66 49380 > https [SYN] Seq=0 Win=8192 Len=0 MSS=1460 WS=256 SACK_PERM=1
5802 1215.129310 192.168.43.101 -> 74.125.135.100 TCP 66 49381 > https [SYN] Seq=0 Win=8192 Len=0 MSS=1460 WS=256 SACK_PERM=1
5803 1215.168485 74.125.135.120 -> 192.168.43.101 TCP 66 https > 49379 [SYN, ACK] Seq=0 Ack=1 Win=42900 Len=0 MSS=1400 SACK_PERM=1 WS=64
5806 1215.189852 74.125.128.106 -> 192.168.43.101 TCP 66 https > 49380 [SYN, ACK] Seq=0 Ack=1 Win=42900 Len=0 MSS=1400 SACK_PERM=1 WS=64
5809 1215.218829 74.125.135.100 -> 192.168.43.101 TCP 66 https > 49381 [SYN, ACK] Seq=0 Ack=1 Win=42900 Len=0 MSS=1400 SACK_PERM=1 WS=64
6253 1227.873811 192.168.43.101 -> 74.125.135.120 TCP 62 49382 > https [SYN] Seq=0 Win=8192 Len=0 MSS=1460 SACK_PERM=1
6254 1227.874338 192.168.43.101 -> 74.125.128.106 TCP 62 49383 > https [SYN] Seq=0 Win=8192 Len=0 MSS=1460 SACK_PERM=1
6256 1228.017570 74.125.135.120 -> 192.168.43.101 TCP 62 https > 49382 [SYN, ACK] Seq=0 Ack=1 Win=42900 Len=0 MSS=1400 SACK_PERM=1
6262 1228.049302 74.125.128.106 -> 192.168.43.101 TCP 62 https > 49383 [SYN, ACK] Seq=0 Ack=1 Win=42900 Len=0 MSS=1400 SACK_PERM=1
6276 1228.199417 192.168.43.101 -> 70.38.40.185 TCP 66 49384 > http [SYN] Seq=0 Win=8192 Len=0 MSS=1460 WS=256 SACK_PERM=1
6286 1228.388739 192.168.43.101 -> 70.38.40.185 TCP 66 49385 > http [SYN] Seq=0 Win=8192 Len=0 MSS=1460 WS=256 SACK_PERM=1
6290 1228.507355 70.38.40.185 -> 192.168.43.101 TCP 66 http > 49384 [SYN, ACK] Seq=0 Ack=1 Win=5840 Len=0 MSS=1400 SACK_PERM=1 WS=128
6293 1228.657348 70.38.40.185 -> 192.168.43.101 TCP 66 http > 49385 [SYN, ACK] Seq=0 Ack=1 Win=5840 Len=0 MSS=1400 SACK_PERM=1 WS=128
6315 1229.559882 192.168.43.101 -> 70.38.40.185 TCP 66 49386 > http [SYN] Seq=0 Win=8192 Len=0 MSS=1460 WS=256 SACK_PERM=1
6316 1229.562618 192.168.43.101 -> 70.38.40.185 TCP 66 49387 > http [SYN] Seq=0 Win=8192 Len=0 MSS=1460 WS=256 SACK_PERM=1
6319 1229.580887 192.168.43.101 -> 70.38.40.185 TCP 66 49388 > http [SYN] Seq=0 Win=8192 Len=0 MSS=1460 WS=256 SACK_PERM=1
6320 1229.584699 192.168.43.101 -> 70.38.40.185 TCP 66 49389 > http [SYN] Seq=0 Win=8192 Len=0 MSS=1460 WS=256 SACK_PERM=1
6321 1229.585869 192.168.43.101 -> 70.38.40.185 TCP 66 49390 > http [SYN] Seq=0 Win=8192 Len=0 MSS=1460 WS=256 SACK_PERM=1
6324 1229.679396 192.168.43.101 -> 68.232.44.196 TCP 66 49391 > http [SYN] Seq=0 Win=8192 Len=0 MSS=1460 WS=256 SACK_PERM=1
6326 1229.777675 68.232.44.196 -> 192.168.43.101 TCP 66 http > 49391 [SYN, ACK] Seq=0 Ack=1 Win=14600 Len=0 MSS=1400 SACK_PERM=1 WS=64
6333 1229.847459 70.38.40.185 -> 192.168.43.101 TCP 66 http > 49386 [SYN, ACK] Seq=0 Ack=1 Win=5840 Len=0 MSS=1400 SACK_PERM=1 WS=128
6336 1229.879017 70.38.40.185 -> 192.168.43.101 TCP 66 http > 49387 [SYN, ACK] Seq=0 Ack=1 Win=5840 Len=0 MSS=1400 SACK_PERM=1 WS=128
6339 1229.887495 70.38.40.185 -> 192.168.43.101 TCP 66 http > 49388 [SYN, ACK] Seq=0 Ack=1 Win=5840 Len=0 MSS=1400 SACK_PERM=1 WS=128
6342 1229.907885 70.38.40.185 -> 192.168.43.101 TCP 66 http > 49389 [SYN, ACK] Seq=0 Ack=1 Win=5840 Len=0 MSS=1400 SACK_PERM=1 WS=128
6345 1229.908492 70.38.40.185 -> 192.168.43.101 TCP 66 http > 49390 [SYN, ACK] Seq=0 Ack=1 Win=5840 Len=0 MSS=1400 SACK_PERM=1 WS=128
6360 1230.059039 192.168.43.101 -> 199.27.77.130 TCP 66 49392 > http [SYN] Seq=0 Win=8192 Len=0 MSS=1460 WS=256 SACK_PERM=1
6373 1230.180500 192.168.43.101 -> 70.38.40.185 TCP 66 49393 > http [SYN] Seq=0 Win=8192 Len=0 MSS=1460 WS=256 SACK_PERM=1
6374 1230.257667 192.168.43.101 -> 199.27.77.130 TCP 66 49394 > http [SYN] Seq=0 Win=8192 Len=0 MSS=1460 WS=256 SACK_PERM=1
6390 1230.284644 192.168.43.101 -> 70.38.40.185 TCP 66 49395 > http [SYN] Seq=0 Win=8192 Len=0 MSS=1460 WS=256 SACK_PERM=1
6394 1230.290367 192.168.43.101 -> 70.38.40.185 TCP 66 49396 > http [SYN] Seq=0 Win=8192 Len=0 MSS=1460 WS=256 SACK_PERM=1
6403 1230.310679 192.168.43.101 -> 70.38.40.185 TCP 66 49397 > http [SYN] Seq=0 Win=8192 Len=0 MSS=1460 WS=256 SACK_PERM=1
6408 1230.320281 192.168.43.101 -> 70.38.40.185 TCP 66 49398 > http [SYN] Seq=0 Win=8192 Len=0 MSS=1460 WS=256 SACK_PERM=1
6411 1230.327230 192.168.43.101 -> 70.38.40.185 TCP 66 49399 > http [SYN] Seq=0 Win=8192 Len=0 MSS=1460 WS=256 SACK_PERM=1
6412 1230.327852 199.27.77.130 -> 192.168.43.101 TCP 66 http > 49392 [SYN, ACK] Seq=0 Ack=1 Win=14600 Len=0 MSS=1400 SACK_PERM=1 WS=512
6416 1230.439055 192.168.43.101 -> 74.125.135.139 TCP 66 49400 > https [SYN] Seq=0 Win=8192 Len=0 MSS=1460 WS=256 SACK_PERM=1
6418 1230.507462 70.38.40.185 -> 192.168.43.101 TCP 66 http > 49393 [SYN, ACK] Seq=0 Ack=1 Win=5840 Len=0 MSS=1400 SACK_PERM=1 WS=128
6421 1230.537720 74.125.135.139 -> 192.168.43.101 TCP 66 https > 49400 [SYN, ACK] Seq=0 Ack=1 Win=42900 Len=0 MSS=1400 SACK_PERM=1 WS=64
6425 1230.617734 70.38.40.185 -> 192.168.43.101 TCP 66 http > 49395 [SYN, ACK] Seq=0 Ack=1 Win=5840 Len=0 MSS=1400 SACK_PERM=1 WS=128
6430 1230.639825 70.38.40.185 -> 192.168.43.101 TCP 66 http > 49396 [SYN, ACK] Seq=0 Ack=1 Win=5840 Len=0 MSS=1400 SACK_PERM=1 WS=128
6436 1230.679443 70.38.40.185 -> 192.168.43.101 TCP 66 http > 49398 [SYN, ACK] Seq=0 Ack=1 Win=5840 Len=0 MSS=1400 SACK_PERM=1 WS=128
6442 1230.683563 70.38.40.185 -> 192.168.43.101 TCP 66 http > 49397 [SYN, ACK] Seq=0 Ack=1 Win=5840 Len=0 MSS=1400 SACK_PERM=1 WS=128
6444 1230.684203 70.38.40.185 -> 192.168.43.101 TCP 66 http > 49399 [SYN, ACK] Seq=0 Ack=1 Win=5840 Len=0 MSS=1400 SACK_PERM=1 WS=128
6486 1230.979530 192.168.43.101 -> 70.38.40.185 TCP 66 49401 > http [SYN] Seq=0 Win=8192 Len=0 MSS=1460 WS=256 SACK_PERM=1
6497 1231.033597 192.168.43.101 -> 70.38.40.185 TCP 66 49402 > http [SYN] Seq=0 Win=8192 Len=0 MSS=1460 WS=256 SACK_PERM=1
6510 1231.060059 192.168.43.101 -> 70.38.40.185 TCP 66 49403 > http [SYN] Seq=0 Win=8192 Len=0 MSS=1460 WS=256 SACK_PERM=1
6512 1231.060928 192.168.43.101 -> 70.38.40.185 TCP 66 49404 > http [SYN] Seq=0 Win=8192 Len=0 MSS=1460 WS=256 SACK_PERM=1
6557 1231.165871 192.168.43.101 -> 70.38.40.185 TCP 66 49405 > http [SYN] Seq=0 Win=8192 Len=0 MSS=1460 WS=256 SACK_PERM=1
6559 1231.171018 192.168.43.101 -> 74.125.135.138 TCP 62 49406 > http [SYN] Seq=0 Win=8192 Len=0 MSS=1460 SACK_PERM=1
6571 1231.308880 192.168.43.101 -> 74.125.135.138 TCP 62 49407 > http [SYN] Seq=0 Win=8192 Len=0 MSS=1460 SACK_PERM=1
6588 1231.359983 70.38.40.185 -> 192.168.43.101 TCP 66 http > 49401 [SYN, ACK] Seq=0 Ack=1 Win=5840 Len=0 MSS=1400 SACK_PERM=1 WS=128
6591 1231.362835 74.125.135.138 -> 192.168.43.101 TCP 62 http > 49406 [SYN, ACK] Seq=0 Ack=1 Win=42900 Len=0 MSS=1400 SACK_PERM=1
6596 1231.377389 70.38.40.185 -> 192.168.43.101 TCP 66 http > 49402 [SYN, ACK] Seq=0 Ack=1 Win=5840 Len=0 MSS=1400 SACK_PERM=1 WS=128
6600 1231.408837 74.125.135.138 -> 192.168.43.101 TCP 62 http > 49407 [SYN, ACK] Seq=0 Ack=1 Win=42900 Len=0 MSS=1400 SACK_PERM=1
6632 1231.513231 70.38.40.185 -> 192.168.43.101 TCP 66 http > 49404 [SYN, ACK] Seq=0 Ack=1 Win=5840 Len=0 MSS=1400 SACK_PERM=1 WS=128
6637 1231.513724 70.38.40.185 -> 192.168.43.101 TCP 66 http > 49403 [SYN, ACK] Seq=0 Ack=1 Win=5840 Len=0 MSS=1400 SACK_PERM=1 WS=128
6700 1231.600757 192.168.43.101 -> 70.38.40.185 TCP 66 49408 > http [SYN] Seq=0 Win=8192 Len=0 MSS=1460 WS=256 SACK_PERM=1
6705 1231.605629 70.38.40.185 -> 192.168.43.101 TCP 66 http > 49405 [SYN, ACK] Seq=0 Ack=1 Win=5840 Len=0 MSS=1400 SACK_PERM=1 WS=128
6712 1231.627353 199.27.77.130 -> 192.168.43.101 TCP 66 http > 49394 [SYN, ACK] Seq=0 Ack=1 Win=14600 Len=0 MSS=1400 SACK_PERM=1 WS=512
6716 1231.639478 192.168.43.101 -> 74.125.135.101 TCP 66 49409 > https [SYN] Seq=0 Win=8192 Len=0 MSS=1460 WS=256 SACK_PERM=1
6717 1231.639952 192.168.43.101 -> 173.194.38.149 TCP 66 49410 > https [SYN] Seq=0 Win=8192 Len=0 MSS=1460 WS=256 SACK_PERM=1
6725 1231.652542 192.168.43.101 -> 173.194.126.30 TCP 66 49411 > https [SYN] Seq=0 Win=8192 Len=0 MSS=1460 WS=256 SACK_PERM=1
6726 1231.652998 192.168.43.101 -> 74.125.135.84 TCP 66 49412 > https [SYN] Seq=0 Win=8192 Len=0 MSS=1460 WS=256 SACK_PERM=1
6729 1231.747785 173.194.38.149 -> 192.168.43.101 TCP 66 https > 49410 [SYN, ACK] Seq=0 Ack=1 Win=42900 Len=0 MSS=1400 SACK_PERM=1 WS=64
6733 1231.767656 74.125.135.101 -> 192.168.43.101 TCP 66 https > 49409 [SYN, ACK] Seq=0 Ack=1 Win=42900 Len=0 MSS=1400 SACK_PERM=1 WS=64
6736 1231.768678 173.194.126.30 -> 192.168.43.101 TCP 66 https > 49411 [SYN, ACK] Seq=0 Ack=1 Win=42900 Len=0 MSS=1400 SACK_PERM=1 WS=64
6739 1231.772019 74.125.135.84 -> 192.168.43.101 TCP 66 https > 49412 [SYN, ACK] Seq=0 Ack=1 Win=42900 Len=0 MSS=1400 SACK_PERM=1 WS=64
6794 1231.933907 70.38.40.185 -> 192.168.43.101 TCP 66 http > 49408 [SYN, ACK] Seq=0 Ack=1 Win=5840 Len=0 MSS=1400 SACK_PERM=1 WS=128
6820 1231.986620 192.168.43.101 -> 70.38.40.185 TCP 62 49413 > http [SYN] Seq=0 Win=8192 Len=0 MSS=1460 SACK_PERM=1
6822 1231.988496 192.168.43.101 -> 70.38.40.185 TCP 62 49414 > http [SYN] Seq=0 Win=8192 Len=0 MSS=1460 SACK_PERM=1
6839 1232.307684 70.38.40.185 -> 192.168.43.101 TCP 62 http > 49413 [SYN, ACK] Seq=0 Ack=1 Win=5840 Len=0 MSS=1400 SACK_PERM=1
6849 1232.329635 70.38.40.185 -> 192.168.43.101 TCP 62 http > 49414 [SYN, ACK] Seq=0 Ack=1 Win=5840 Len=0 MSS=1400 SACK_PERM=1
6954 1233.642735 192.168.43.101 -> 70.38.40.185 TCP 66 49415 > http [SYN] Seq=0 Win=8192 Len=0 MSS=1460 WS=256 SACK_PERM=1
6955 1233.892794 192.168.43.101 -> 70.38.40.185 TCP 66 49416 > http [SYN] Seq=0 Win=8192 Len=0 MSS=1460 WS=256 SACK_PERM=1
6958 1233.938064 70.38.40.185 -> 192.168.43.101 TCP 66 http > 49415 [SYN, ACK] Seq=0 Ack=1 Win=5840 Len=0 MSS=1400 SACK_PERM=1 WS=128
6961 1234.284244 70.38.40.185 -> 192.168.43.101 TCP 66 http > 49416 [SYN, ACK] Seq=0 Ack=1 Win=5840 Len=0 MSS=1400 SACK_PERM=1 WS=128
7500 1238.414581 70.38.40.185 -> 192.168.43.101 TCP 66 http > 49416 [SYN, ACK] Seq=0 Ack=1 Win=5840 Len=0 MSS=1400 SACK_PERM=1 WS=128
7786 1239.108684 192.168.43.101 -> 74.125.135.91 TCP 66 49417 > https [SYN] Seq=0 Win=8192 Len=0 MSS=1460 WS=256 SACK_PERM=1
7787 1239.207244 74.125.135.91 -> 192.168.43.101 TCP 66 https > 49417 [SYN, ACK] Seq=0 Ack=1 Win=42900 Len=0 MSS=1400 SACK_PERM=1 WS=64
7814 1244.421231 70.38.40.185 -> 192.168.43.101 TCP 66 http > 49416 [SYN, ACK] Seq=0 Ack=1 Win=5840 Len=0 MSS=1400 SACK_PERM=1 WS=128
7820 1252.331117 192.168.43.101 -> 98.158.104.42 TCP 66 49418 > http [SYN] Seq=0 Win=8192 Len=0 MSS=1460 WS=4 SACK_PERM=1
7821 1252.715354 98.158.104.42 -> 192.168.43.101 TCP 66 http > 49418 [SYN, ACK] Seq=0 Ack=1 Win=5840 Len=0 MSS=1400 SACK_PERM=1 WS=128
7830 1253.028327 192.168.43.101 -> 88.198.6.54  TCP 66 49419 > https [SYN] Seq=0 Win=8192 Len=0 MSS=1460 WS=256 SACK_PERM=1
7832 1253.330039  88.198.6.54 -> 192.168.43.101 TCP 66 https > 49419 [SYN, ACK] Seq=0 Ack=1 Win=5840 Len=0 MSS=1400 SACK_PERM=1 WS=128
7859 1276.947464 192.168.43.101 -> 23.35.5.163  TCP 66 49420 > http [SYN] Seq=0 Win=8192 Len=0 MSS=1460 WS=4 SACK_PERM=1
7860 1277.026031  23.35.5.163 -> 192.168.43.101 TCP 66 http > 49420 [SYN, ACK] Seq=0 Ack=1 Win=14600 Len=0 MSS=1400 SACK_PERM=1 WS=2
7971 1277.657271 192.168.43.101 -> 199.7.54.72  TCP 66 49421 > http [SYN] Seq=0 Win=8192 Len=0 MSS=1460 WS=256 SACK_PERM=1
7973 1278.007444  199.7.54.72 -> 192.168.43.101 TCP 58 http > 49421 [SYN, ACK] Seq=0 Ack=1 Win=8190 Len=0 MSS=1360
7985 1278.527495 192.168.43.101 -> 182.50.136.239 TCP 66 49422 > http [SYN] Seq=0 Win=8192 Len=0 MSS=1460 WS=256 SACK_PERM=1
7986 1278.636163 182.50.136.239 -> 192.168.43.101 TCP 58 http > 49422 [SYN, ACK] Seq=0 Ack=1 Win=5840 Len=0 MSS=1400
8000 1278.897099 192.168.43.101 -> 74.125.135.120 TCP 66 49423 > http [SYN] Seq=0 Win=8192 Len=0 MSS=1460 WS=256 SACK_PERM=1
8002 1278.995833 74.125.135.120 -> 192.168.43.101 TCP 66 http > 49423 [SYN, ACK] Seq=0 Ack=1 Win=42900 Len=0 MSS=1400 SACK_PERM=1 WS=64
8051 1325.132042 192.168.43.101 -> 88.198.6.54  TCP 66 49424 > https [SYN] Seq=0 Win=8192 Len=0 MSS=1460 WS=256 SACK_PERM=1
8053 1325.417265  88.198.6.54 -> 192.168.43.101 TCP 66 https > 49424 [SYN, ACK] Seq=0 Ack=1 Win=5840 Len=0 MSS=1400 SACK_PERM=1 WS=128
